"code","set","dim","grade","statement","dimension","orig_dimension","orig_dim","subject","link","code2","subcategory","subcat","PEcode","performanceExpectation","clarifyingStatement","assessmentBoundary","goal"
"RST.6-8.1","Common Core ELA","R","6,7,8","Cite specific textual evidence to support analysis of science and technical texts.","Reading","Reading: Science & Technical Subjects","RST","ELA","http://corestandards.org/ELA-Literacy/RST/6-8/1/",NA,NA,NA,NA,NA,NA,NA,NA
"RST.6-8.2","Common Core ELA","R","6,7,8","Determine the central ideas or conclusions of a text; provide an accurate summary of the text distinct from prior knowledge or opinions.","Reading","Reading: Science & Technical Subjects","RST","ELA","http://corestandards.org/ELA-Literacy/RST/6-8/2/",NA,NA,NA,NA,NA,NA,NA,NA
"RST.6-8.3","Common Core ELA","R","6,7,8","Follow precisely a multistep procedure when carrying out experiments, taking measurements, or performing technical tasks.","Reading","Reading: Science & Technical Subjects","RST","ELA","http://corestandards.org/ELA-Literacy/RST/6-8/3/",NA,NA,NA,NA,NA,NA,NA,NA
"RST.6-8.4","Common Core ELA","R","6,7,8","Determine the meaning of symbols, key terms, and other domain-specific words and phrases as they are used in a specific scientific or technical context relevant to <em>grades 6-8 texts and topics</em>.","Reading","Reading: Science & Technical Subjects","RST","ELA","http://corestandards.org/ELA-Literacy/RST/6-8/4/",NA,NA,NA,NA,NA,NA,NA,NA
"RST.6-8.5","Common Core ELA","R","6,7,8","Analyze the structure an author uses to organize a text, including how the major sections contribute to the whole and to an understanding of the topic.","Reading","Reading: Science & Technical Subjects","RST","ELA","http://corestandards.org/ELA-Literacy/RST/6-8/5/",NA,NA,NA,NA,NA,NA,NA,NA
"RST.6-8.6","Common Core ELA","R","6,7,8","Analyze the author's purpose in providing an explanation, describing a procedure, or discussing an experiment in a text.","Reading","Reading: Science & Technical Subjects","RST","ELA","http://corestandards.org/ELA-Literacy/RST/6-8/6/",NA,NA,NA,NA,NA,NA,NA,NA
"RST.6-8.7","Common Core ELA","R","6,7,8","Integrate quantitative or technical information expressed in words in a text with a version of that information expressed visually (e.g., in a flowchart, diagram, model, graph, or table).","Reading","Reading: Science & Technical Subjects","RST","ELA","http://corestandards.org/ELA-Literacy/RST/6-8/7/",NA,NA,NA,NA,NA,NA,NA,NA
"RST.6-8.8","Common Core ELA","R","6,7,8","Distinguish among facts, reasoned judgment based on research findings, and speculation in a text.","Reading","Reading: Science & Technical Subjects","RST","ELA","http://corestandards.org/ELA-Literacy/RST/6-8/8/",NA,NA,NA,NA,NA,NA,NA,NA
"RST.6-8.9","Common Core ELA","R","6,7,8","Compare and contrast the information gained from experiments, simulations, video, or multimedia sources with that gained from reading a text on the same topic.","Reading","Reading: Science & Technical Subjects","RST","ELA","http://corestandards.org/ELA-Literacy/RST/6-8/9/",NA,NA,NA,NA,NA,NA,NA,NA
"RST.6-8.10","Common Core ELA","R","6,7,8","By the end of grade 8, read and comprehend science/technical texts in the grades 6-8 text complexity band independently and proficiently.","Reading","Reading: Science & Technical Subjects","RST","ELA","http://corestandards.org/ELA-Literacy/RST/6-8/10/",NA,NA,NA,NA,NA,NA,NA,NA
"RST.9-10.1","Common Core ELA","R","9,10","Cite specific textual evidence to support analysis of science and technical texts, attending to the precise details of explanations or descriptions.","Reading","Reading: Science & Technical Subjects","RST","ELA","http://corestandards.org/ELA-Literacy/RST/9-10/1/",NA,NA,NA,NA,NA,NA,NA,NA
"RST.9-10.2","Common Core ELA","R","9,10","Determine the central ideas or conclusions of a text; trace the text's explanation or depiction of a complex process, phenomenon, or concept; provide an accurate summary of the text.","Reading","Reading: Science & Technical Subjects","RST","ELA","http://corestandards.org/ELA-Literacy/RST/9-10/2/",NA,NA,NA,NA,NA,NA,NA,NA
"RST.9-10.3","Common Core ELA","R","9,10","Follow precisely a complex multistep procedure when carrying out experiments, taking measurements, or performing technical tasks, attending to special cases or exceptions defined in the text.","Reading","Reading: Science & Technical Subjects","RST","ELA","http://corestandards.org/ELA-Literacy/RST/9-10/3/",NA,NA,NA,NA,NA,NA,NA,NA
"RST.9-10.4","Common Core ELA","R","9,10","Determine the meaning of symbols, key terms, and other domain-specific words and phrases as they are used in a specific scientific or technical context relevant to <em>grades 9-10 texts and topics</em>.","Reading","Reading: Science & Technical Subjects","RST","ELA","http://corestandards.org/ELA-Literacy/RST/9-10/4/",NA,NA,NA,NA,NA,NA,NA,NA
"RST.9-10.5","Common Core ELA","R","9,10","Analyze the structure of the relationships among concepts in a text, including relationships among key terms (e.g., <em>force, friction, reaction force, energy</em>).","Reading","Reading: Science & Technical Subjects","RST","ELA","http://corestandards.org/ELA-Literacy/RST/9-10/5/",NA,NA,NA,NA,NA,NA,NA,NA
"RST.9-10.6","Common Core ELA","R","9,10","Analyze the author's purpose in providing an explanation, describing a procedure, or discussing an experiment in a text, defining the question the author seeks to address.","Reading","Reading: Science & Technical Subjects","RST","ELA","http://corestandards.org/ELA-Literacy/RST/9-10/6/",NA,NA,NA,NA,NA,NA,NA,NA
"RST.9-10.7","Common Core ELA","R","9,10","Translate quantitative or technical information expressed in words in a text into visual form (e.g., a table or chart) and translate information expressed visually or mathematically (e.g., in an equation) into words.","Reading","Reading: Science & Technical Subjects","RST","ELA","http://corestandards.org/ELA-Literacy/RST/9-10/7/",NA,NA,NA,NA,NA,NA,NA,NA
"RST.9-10.8","Common Core ELA","R","9,10","Assess the extent to which the reasoning and evidence in a text support the author's claim or a recommendation for solving a scientific or technical problem.","Reading","Reading: Science & Technical Subjects","RST","ELA","http://corestandards.org/ELA-Literacy/RST/9-10/8/",NA,NA,NA,NA,NA,NA,NA,NA
"RST.9-10.9","Common Core ELA","R","9,10","Compare and contrast findings presented in a text to those from other sources (including their own experiments), noting when the findings support or contradict previous explanations or accounts.","Reading","Reading: Science & Technical Subjects","RST","ELA","http://corestandards.org/ELA-Literacy/RST/9-10/9/",NA,NA,NA,NA,NA,NA,NA,NA
"RST.9-10.10","Common Core ELA","R","9,10","By the end of grade 10, read and comprehend science/technical texts in the grades 9-10 text complexity band independently and proficiently.","Reading","Reading: Science & Technical Subjects","RST","ELA","http://corestandards.org/ELA-Literacy/RST/9-10/10/",NA,NA,NA,NA,NA,NA,NA,NA
"RST.11-12.1","Common Core ELA","R","11,12","Cite specific textual evidence to support analysis of science and technical texts, attending to important distinctions the author makes and to any gaps or inconsistencies in the account.","Reading","Reading: Science & Technical Subjects","RST","ELA","http://corestandards.org/ELA-Literacy/RST/11-12/1/",NA,NA,NA,NA,NA,NA,NA,NA
"RST.11-12.2","Common Core ELA","R","11,12","Determine the central ideas or conclusions of a text; summarize complex concepts, processes, or information presented in a text by paraphrasing them in simpler but still accurate terms.","Reading","Reading: Science & Technical Subjects","RST","ELA","http://corestandards.org/ELA-Literacy/RST/11-12/2/",NA,NA,NA,NA,NA,NA,NA,NA
"RST.11-12.3","Common Core ELA","R","11,12","Follow precisely a complex multistep procedure when carrying out experiments, taking measurements, or performing technical tasks; analyze the specific results based on explanations in the text.","Reading","Reading: Science & Technical Subjects","RST","ELA","http://corestandards.org/ELA-Literacy/RST/11-12/3/",NA,NA,NA,NA,NA,NA,NA,NA
"RST.11-12.4","Common Core ELA","R","11,12","Determine the meaning of symbols, key terms, and other domain-specific words and phrases as they are used in a specific scientific or technical context relevant to <em>grades 11-12 texts and topics</em>.","Reading","Reading: Science & Technical Subjects","RST","ELA","http://corestandards.org/ELA-Literacy/RST/11-12/4/",NA,NA,NA,NA,NA,NA,NA,NA
"RST.11-12.5","Common Core ELA","R","11,12","Analyze how the text structures information or ideas into categories or hierarchies, demonstrating understanding of the information or ideas.","Reading","Reading: Science & Technical Subjects","RST","ELA","http://corestandards.org/ELA-Literacy/RST/11-12/5/",NA,NA,NA,NA,NA,NA,NA,NA
"RST.11-12.6","Common Core ELA","R","11,12","Analyze the author's purpose in providing an explanation, describing a procedure, or discussing an experiment in a text, identifying important issues that remain unresolved.","Reading","Reading: Science & Technical Subjects","RST","ELA","http://corestandards.org/ELA-Literacy/RST/11-12/6/",NA,NA,NA,NA,NA,NA,NA,NA
"RST.11-12.7","Common Core ELA","R","11,12","Integrate and evaluate multiple sources of information presented in diverse formats and media (e.g., quantitative data, video, multimedia) in order to address a question or solve a problem.","Reading","Reading: Science & Technical Subjects","RST","ELA","http://corestandards.org/ELA-Literacy/RST/11-12/7/",NA,NA,NA,NA,NA,NA,NA,NA
"RST.11-12.8","Common Core ELA","R","11,12","Evaluate the hypotheses, data, analysis, and conclusions in a science or technical text, verifying the data when possible and corroborating or challenging conclusions with other sources of information.","Reading","Reading: Science & Technical Subjects","RST","ELA","http://corestandards.org/ELA-Literacy/RST/11-12/8/",NA,NA,NA,NA,NA,NA,NA,NA
"RST.11-12.9","Common Core ELA","R","11,12","Synthesize information from a range of sources (e.g., texts, experiments, simulations) into a coherent understanding of a process, phenomenon, or concept, resolving conflicting information when possible.","Reading","Reading: Science & Technical Subjects","RST","ELA","http://corestandards.org/ELA-Literacy/RST/11-12/9/",NA,NA,NA,NA,NA,NA,NA,NA
"RST.11-12.10","Common Core ELA","R","11,12","By the end of grade 12, read and comprehend science/technical texts in the grades 11-CCR text complexity band independently and proficiently.","Reading","Reading: Science & Technical Subjects","RST","ELA","http://corestandards.org/ELA-Literacy/RST/11-12/10/",NA,NA,NA,NA,NA,NA,NA,NA
"SL.K.1","Common Core ELA","LS&L","K","Participate in collaborative conversations with diverse partners about <i>kindergarten topics and texts</i> with peers and adults in small and larger groups.","Language, Speaking & Listening","Speaking & Listening","SL","ELA","http://corestandards.org/ELA-Literacy/SL/K/1/",NA,NA,NA,NA,NA,NA,NA,NA
"SL.K.1a","Common Core ELA","LS&L","K","Follow agreed-upon rules for discussions (e.g., listening to others and taking turns speaking about the topics and texts under discussion).","Language, Speaking & Listening","Speaking & Listening","SL","ELA","http://corestandards.org/ELA-Literacy/SL/K/1/a/",NA,NA,NA,NA,NA,NA,NA,NA
"SL.K.1b","Common Core ELA","LS&L","K","Continue a conversation through multiple exchanges.","Language, Speaking & Listening","Speaking & Listening","SL","ELA","http://corestandards.org/ELA-Literacy/SL/K/1/b/",NA,NA,NA,NA,NA,NA,NA,NA
"SL.K.2","Common Core ELA","LS&L","K","Confirm understanding of a text read aloud or information presented orally or through other media by asking and answering questions about key details and requesting clarification if something is not understood.","Language, Speaking & Listening","Speaking & Listening","SL","ELA","http://corestandards.org/ELA-Literacy/SL/K/2/",NA,NA,NA,NA,NA,NA,NA,NA
"SL.K.3","Common Core ELA","LS&L","K","Ask and answer questions in order to seek help, get information, or clarify something that is not understood.","Language, Speaking & Listening","Speaking & Listening","SL","ELA","http://corestandards.org/ELA-Literacy/SL/K/3/",NA,NA,NA,NA,NA,NA,NA,NA
"SL.K.4","Common Core ELA","LS&L","K","Describe familiar people, places, things, and events and, with prompting and support, provide additional detail.","Language, Speaking & Listening","Speaking & Listening","SL","ELA","http://corestandards.org/ELA-Literacy/SL/K/4/",NA,NA,NA,NA,NA,NA,NA,NA
"SL.K.5","Common Core ELA","LS&L","K","Add drawings or other visual displays to descriptions as desired to provide additional detail.","Language, Speaking & Listening","Speaking & Listening","SL","ELA","http://corestandards.org/ELA-Literacy/SL/K/5/",NA,NA,NA,NA,NA,NA,NA,NA
"SL.K.6","Common Core ELA","LS&L","K","Speak audibly and express thoughts, feelings, and ideas clearly.","Language, Speaking & Listening","Speaking & Listening","SL","ELA","http://corestandards.org/ELA-Literacy/SL/K/6/",NA,NA,NA,NA,NA,NA,NA,NA
"SL.1.1","Common Core ELA","LS&L","01","Participate in collaborative conversations with diverse partners about <i>grade 1 topics and texts</i> with peers and adults in small and larger groups.","Language, Speaking & Listening","Speaking & Listening","SL","ELA","http://corestandards.org/ELA-Literacy/SL/1/1/",NA,NA,NA,NA,NA,NA,NA,NA
"SL.1.1a","Common Core ELA","LS&L","01","Follow agreed-upon rules for discussions (e.g., listening to others with care, speaking one at a time about the topics and texts under discussion).","Language, Speaking & Listening","Speaking & Listening","SL","ELA","http://corestandards.org/ELA-Literacy/SL/1/1/a/",NA,NA,NA,NA,NA,NA,NA,NA
"SL.1.1b","Common Core ELA","LS&L","01","Build on others' talk in conversations by responding to the comments of others through multiple exchanges.","Language, Speaking & Listening","Speaking & Listening","SL","ELA","http://corestandards.org/ELA-Literacy/SL/1/1/b/",NA,NA,NA,NA,NA,NA,NA,NA
"SL.1.1c","Common Core ELA","LS&L","01","Ask questions to clear up any confusion about the topics and texts under discussion.","Language, Speaking & Listening","Speaking & Listening","SL","ELA","http://corestandards.org/ELA-Literacy/SL/1/1/c/",NA,NA,NA,NA,NA,NA,NA,NA
"SL.1.2","Common Core ELA","LS&L","01","Ask and answer questions about key details in a text read aloud or information presented orally or through other media.","Language, Speaking & Listening","Speaking & Listening","SL","ELA","http://corestandards.org/ELA-Literacy/SL/1/2/",NA,NA,NA,NA,NA,NA,NA,NA
"SL.1.3","Common Core ELA","LS&L","01","Ask and answer questions about what a speaker says in order to gather additional information or clarify something that is not understood.","Language, Speaking & Listening","Speaking & Listening","SL","ELA","http://corestandards.org/ELA-Literacy/SL/1/3/",NA,NA,NA,NA,NA,NA,NA,NA
"SL.1.4","Common Core ELA","LS&L","01","Describe people, places, things, and events with relevant details, expressing ideas and feelings clearly.","Language, Speaking & Listening","Speaking & Listening","SL","ELA","http://corestandards.org/ELA-Literacy/SL/1/4/",NA,NA,NA,NA,NA,NA,NA,NA
"SL.1.5","Common Core ELA","LS&L","01","Add drawings or other visual displays to descriptions when appropriate to clarify ideas, thoughts, and feelings.","Language, Speaking & Listening","Speaking & Listening","SL","ELA","http://corestandards.org/ELA-Literacy/SL/1/5/",NA,NA,NA,NA,NA,NA,NA,NA
"SL.1.6","Common Core ELA","LS&L","01","Produce complete sentences when appropriate to task and situation. (See grade 1 Language standards 1 and 3 [link to=""CCSS.ELA-Literacy.L.1""]here[/link] for specific expectations.)","Language, Speaking & Listening","Speaking & Listening","SL","ELA","http://corestandards.org/ELA-Literacy/SL/1/6/",NA,NA,NA,NA,NA,NA,NA,NA
"SL.2.1","Common Core ELA","LS&L","02","Participate in collaborative conversations with diverse partners about <i>grade 2 topics and texts</i> with peers and adults in small and larger groups.","Language, Speaking & Listening","Speaking & Listening","SL","ELA","http://corestandards.org/ELA-Literacy/SL/2/1/",NA,NA,NA,NA,NA,NA,NA,NA
"SL.2.1a","Common Core ELA","LS&L","02","Follow agreed-upon rules for discussions (e.g., gaining the floor in respectful ways, listening to others with care, speaking one at a time about the topics and texts under discussion).","Language, Speaking & Listening","Speaking & Listening","SL","ELA","http://corestandards.org/ELA-Literacy/SL/2/1/a/",NA,NA,NA,NA,NA,NA,NA,NA
"SL.2.1b","Common Core ELA","LS&L","02","Build on others' talk in conversations by linking their comments to the remarks of others.","Language, Speaking & Listening","Speaking & Listening","SL","ELA","http://corestandards.org/ELA-Literacy/SL/2/1/b/",NA,NA,NA,NA,NA,NA,NA,NA
"SL.2.1c","Common Core ELA","LS&L","02","Ask for clarification and further explanation as needed about the topics and texts under discussion.","Language, Speaking & Listening","Speaking & Listening","SL","ELA","http://corestandards.org/ELA-Literacy/SL/2/1/c/",NA,NA,NA,NA,NA,NA,NA,NA
"SL.2.2","Common Core ELA","LS&L","02","Recount or describe key ideas or details from a text read aloud or information presented orally or through other media.","Language, Speaking & Listening","Speaking & Listening","SL","ELA","http://corestandards.org/ELA-Literacy/SL/2/2/",NA,NA,NA,NA,NA,NA,NA,NA
"SL.2.3","Common Core ELA","LS&L","02","Ask and answer questions about what a speaker says in order to clarify comprehension, gather additional information, or deepen understanding of a topic or issue.","Language, Speaking & Listening","Speaking & Listening","SL","ELA","http://corestandards.org/ELA-Literacy/SL/2/3/",NA,NA,NA,NA,NA,NA,NA,NA
"SL.2.4","Common Core ELA","LS&L","02","Tell a story or recount an experience with appropriate facts and relevant, descriptive details, speaking audibly in coherent sentences.","Language, Speaking & Listening","Speaking & Listening","SL","ELA","http://corestandards.org/ELA-Literacy/SL/2/4/",NA,NA,NA,NA,NA,NA,NA,NA
"SL.2.5","Common Core ELA","LS&L","02","Create audio recordings of stories or poems; add drawings or other visual displays to stories or recounts of experiences when appropriate to clarify ideas, thoughts, and feelings.","Language, Speaking & Listening","Speaking & Listening","SL","ELA","http://corestandards.org/ELA-Literacy/SL/2/5/",NA,NA,NA,NA,NA,NA,NA,NA
"SL.2.6","Common Core ELA","LS&L","02","Produce complete sentences when appropriate to task and situation in order to provide requested detail or clarification. (See grade 2 Language standards 1 and 3 [link to=""CCSS.ELA-Literacy.L.2""]here[/link] for specific expectations.)","Language, Speaking & Listening","Speaking & Listening","SL","ELA","http://corestandards.org/ELA-Literacy/SL/2/6/",NA,NA,NA,NA,NA,NA,NA,NA
"SL.3.1","Common Core ELA","LS&L","03","Engage effectively in a range of collaborative discussions (one-on-one, in groups, and teacher-led) with diverse partners on <i>grade 3 topics and texts</i>, building on others' ideas and expressing their own clearly.","Language, Speaking & Listening","Speaking & Listening","SL","ELA","http://corestandards.org/ELA-Literacy/SL/3/1/",NA,NA,NA,NA,NA,NA,NA,NA
"SL.3.1a","Common Core ELA","LS&L","03","Come to discussions prepared, having read or studied required material; explicitly draw on that preparation and other information known about the topic to explore ideas under discussion.","Language, Speaking & Listening","Speaking & Listening","SL","ELA","http://corestandards.org/ELA-Literacy/SL/3/1/a/",NA,NA,NA,NA,NA,NA,NA,NA
"SL.3.1b","Common Core ELA","LS&L","03","Follow agreed-upon rules for discussions (e.g., gaining the floor in respectful ways, listening to others with care, speaking one at a time about the topics and texts under discussion).","Language, Speaking & Listening","Speaking & Listening","SL","ELA","http://corestandards.org/ELA-Literacy/SL/3/1/b/",NA,NA,NA,NA,NA,NA,NA,NA
"SL.3.1c","Common Core ELA","LS&L","03","Ask questions to check understanding of information presented, stay on topic, and link their comments to the remarks of others.","Language, Speaking & Listening","Speaking & Listening","SL","ELA","http://corestandards.org/ELA-Literacy/SL/3/1/c/",NA,NA,NA,NA,NA,NA,NA,NA
"SL.3.1d","Common Core ELA","LS&L","03","Explain their own ideas and understanding in light of the discussion.","Language, Speaking & Listening","Speaking & Listening","SL","ELA","http://corestandards.org/ELA-Literacy/SL/3/1/d/",NA,NA,NA,NA,NA,NA,NA,NA
"SL.3.2","Common Core ELA","LS&L","03","Determine the main ideas and supporting details of a text read aloud or information presented in diverse media and formats, including visually, quantitatively, and orally.","Language, Speaking & Listening","Speaking & Listening","SL","ELA","http://corestandards.org/ELA-Literacy/SL/3/2/",NA,NA,NA,NA,NA,NA,NA,NA
"SL.3.3","Common Core ELA","LS&L","03","Ask and answer questions about information from a speaker, offering appropriate elaboration and detail.","Language, Speaking & Listening","Speaking & Listening","SL","ELA","http://corestandards.org/ELA-Literacy/SL/3/3/",NA,NA,NA,NA,NA,NA,NA,NA
"SL.3.4","Common Core ELA","LS&L","03","Report on a topic or text, tell a story, or recount an experience with appropriate facts and relevant, descriptive details, speaking clearly at an understandable pace.","Language, Speaking & Listening","Speaking & Listening","SL","ELA","http://corestandards.org/ELA-Literacy/SL/3/4/",NA,NA,NA,NA,NA,NA,NA,NA
"SL.3.5","Common Core ELA","LS&L","03","Create engaging audio recordings of stories or poems that demonstrate fluid reading at an understandable pace; add visual displays when appropriate to emphasize or enhance certain facts or details.","Language, Speaking & Listening","Speaking & Listening","SL","ELA","http://corestandards.org/ELA-Literacy/SL/3/5/",NA,NA,NA,NA,NA,NA,NA,NA
"SL.3.6","Common Core ELA","LS&L","03","Speak in complete sentences when appropriate to task and situation in order to provide requested detail or clarification. (See grade 3 Language standards 1 and 3 [link to=""CCSS.ELA-Literacy.L.3""]here[/link] for specific expectations.)","Language, Speaking & Listening","Speaking & Listening","SL","ELA","http://corestandards.org/ELA-Literacy/SL/3/6/",NA,NA,NA,NA,NA,NA,NA,NA
"SL.4.1","Common Core ELA","LS&L","04","Engage effectively in a range of collaborative discussions (one-on-one, in groups, and teacher-led) with diverse partners on <em>grade 4 topics and texts</em>, building on others' ideas and expressing their own clearly.","Language, Speaking & Listening","Speaking & Listening","SL","ELA","http://corestandards.org/ELA-Literacy/SL/4/1/",NA,NA,NA,NA,NA,NA,NA,NA
"SL.4.1a","Common Core ELA","LS&L","04","Come to discussions prepared, having read or studied required material; explicitly draw on that preparation and other information known about the topic to explore ideas under discussion.","Language, Speaking & Listening","Speaking & Listening","SL","ELA","http://corestandards.org/ELA-Literacy/SL/4/1/a/",NA,NA,NA,NA,NA,NA,NA,NA
"SL.4.1b","Common Core ELA","LS&L","04","Follow agreed-upon rules for discussions and carry out assigned roles.","Language, Speaking & Listening","Speaking & Listening","SL","ELA","http://corestandards.org/ELA-Literacy/SL/4/1/b/",NA,NA,NA,NA,NA,NA,NA,NA
"SL.4.1c","Common Core ELA","LS&L","04","Pose and respond to specific questions to clarify or follow up on information, and make comments that contribute to the discussion and link to the remarks of others.","Language, Speaking & Listening","Speaking & Listening","SL","ELA","http://corestandards.org/ELA-Literacy/SL/4/1/c/",NA,NA,NA,NA,NA,NA,NA,NA
"SL.4.1d","Common Core ELA","LS&L","04","Review the key ideas expressed and explain their own ideas and understanding in light of the discussion.","Language, Speaking & Listening","Speaking & Listening","SL","ELA","http://corestandards.org/ELA-Literacy/SL/4/1/d/",NA,NA,NA,NA,NA,NA,NA,NA
"SL.4.2","Common Core ELA","LS&L","04","Paraphrase portions of a text read aloud or information presented in diverse media and formats, including visually, quantitatively, and orally.","Language, Speaking & Listening","Speaking & Listening","SL","ELA","http://corestandards.org/ELA-Literacy/SL/4/2/",NA,NA,NA,NA,NA,NA,NA,NA
"SL.4.3","Common Core ELA","LS&L","04","Identify the reasons and evidence a speaker provides to support particular points.","Language, Speaking & Listening","Speaking & Listening","SL","ELA","http://corestandards.org/ELA-Literacy/SL/4/3/",NA,NA,NA,NA,NA,NA,NA,NA
"SL.4.4","Common Core ELA","LS&L","04","Report on a topic or text, tell a story, or recount an experience in an organized manner, using appropriate facts and relevant, descriptive details to support main ideas or themes; speak clearly at an understandable pace.","Language, Speaking & Listening","Speaking & Listening","SL","ELA","http://corestandards.org/ELA-Literacy/SL/4/4/",NA,NA,NA,NA,NA,NA,NA,NA
"SL.4.5","Common Core ELA","LS&L","04","Add audio recordings and visual displays to presentations when appropriate to enhance the development of main ideas or themes.","Language, Speaking & Listening","Speaking & Listening","SL","ELA","http://corestandards.org/ELA-Literacy/SL/4/5/",NA,NA,NA,NA,NA,NA,NA,NA
"SL.4.6","Common Core ELA","LS&L","04","Differentiate between contexts that call for formal English (e.g., presenting ideas) and situations where informal discourse is appropriate (e.g., small-group discussion); use formal English when appropriate to task and situation. (See grade 4 Language standards 1 [link to=""CCSS.ELA-Literacy.L.4""]here[/link] for specific expectations.)","Language, Speaking & Listening","Speaking & Listening","SL","ELA","http://corestandards.org/ELA-Literacy/SL/4/6/",NA,NA,NA,NA,NA,NA,NA,NA
