"code","set","dim","grade","statement","dimension","orig_dimension","orig_dim","subject","link","code2","subcategory","subcat","PEcode","performanceExpectation","clarifyingStatement","assessmentBoundary","goal"
"6.EE.B.7","Common Core Math","AGTC&HLT","06","Solve real-world and mathematical problems by writing and solving equations of the form <i>x</i> + <i>p</i> = <i>q</i> and<i> px</i> = <i>q</i> for cases in which <i>p</i>, <i>q</i> and <i>x</i> are all nonnegative rational numbers.","Algebra, Geometry, Trig, Calculus & Higher Level Thinking","Expressions & Equations","EE","Math","http://corestandards.org/Math/Content/6/EE/B/7/","EE.B.7",NA,NA,NA,NA,NA,NA,NA
"6.EE.B.8","Common Core Math","AGTC&HLT","06","Write an inequality of the form <i>x</i> &gt; <i>c</i> or <i>x</i> &lt; <i>c</i> to represent a constraint or condition in a real-world or mathematical problem. Recognize that inequalities of the form <i>x</i> &gt; <i>c</i> or<i> x</i> &lt; c have infinitely many solutions; represent solutions of such inequalities on number line diagrams.","Algebra, Geometry, Trig, Calculus & Higher Level Thinking","Expressions & Equations","EE","Math","http://corestandards.org/Math/Content/6/EE/B/8/","EE.B.8",NA,NA,NA,NA,NA,NA,NA
"6.EE.C.9","Common Core Math","AGTC&HLT","06","Use variables to represent two quantities in a real-world problem that change in relationship to one another; write an equation to express one quantity, thought of as the dependent variable, in terms of the other quantity, thought of as the independent variable. Analyze the relationship between the dependent and independent variables using graphs and tables, and relate these to the equation. For example, in a problem involving motion at constant speed, list and graph ordered pairs of distances and times, and write the equation d = 65t to represent the relationship between distance and time.","Algebra, Geometry, Trig, Calculus & Higher Level Thinking","Expressions & Equations","EE","Math","http://corestandards.org/Math/Content/6/EE/C/9/","EE.C.9",NA,NA,NA,NA,NA,NA,NA
"6.G.A.1","Common Core Math","AGTC&HLT","06","Find the area of right triangles, other triangles, special quadrilaterals, and polygons by composing into rectangles or decomposing into triangles and other shapes; apply these techniques in the context of solving real-world and mathematical problems.","Algebra, Geometry, Trig, Calculus & Higher Level Thinking","Geometry","G","Math","http://corestandards.org/Math/Content/6/G/A/1/","G.A.1",NA,NA,NA,NA,NA,NA,NA
"6.G.A.2","Common Core Math","AGTC&HLT","06","Find the volume of a right rectangular prism with fractional edge lengths by packing it with unit cubes of the appropriate unit fraction edge lengths, and show that the volume is the same as would be found by multiplying the edge lengths of the prism. Apply the formulas <i>V = l w h</i> and <i>V = b h</i> to find volumes of right rectangular prisms with fractional edge lengths in the context of solving real-world and mathematical problems.","Algebra, Geometry, Trig, Calculus & Higher Level Thinking","Geometry","G","Math","http://corestandards.org/Math/Content/6/G/A/2/","G.A.2",NA,NA,NA,NA,NA,NA,NA
"6.G.A.3","Common Core Math","AGTC&HLT","06","Draw polygons in the coordinate plane given coordinates for the vertices; use coordinates to find the length of a side joining points with the same first coordinate or the same second coordinate. Apply these techniques in the context of solving real-world and mathematical problems.","Algebra, Geometry, Trig, Calculus & Higher Level Thinking","Geometry","G","Math","http://corestandards.org/Math/Content/6/G/A/3/","G.A.3",NA,NA,NA,NA,NA,NA,NA
"6.G.A.4","Common Core Math","AGTC&HLT","06","Represent three-dimensional figures using nets made up of rectangles and triangles, and use the nets to find the surface area of these figures. Apply these techniques in the context of solving real-world and mathematical problems.","Algebra, Geometry, Trig, Calculus & Higher Level Thinking","Geometry","G","Math","http://corestandards.org/Math/Content/6/G/A/4/","G.A.4",NA,NA,NA,NA,NA,NA,NA
"6.NS.A.1","Common Core Math","NSO&AR","06","Interpret and compute quotients of fractions, and solve word problems involving division of fractions by fractions, e.g., by using visual fraction models and equations to represent the problem. <i>For example, create a story context for (2/3) &divide; (3/4) and use a visual fraction model to show the quotient; use the relationship between multiplication and division to explain that (2/3) &divide; (3/4) = 8/9 because 3/4 of 8/9 is 2/3. (In general, (a/b) &divide; (c/d) = ad/bc.) How much chocolate will each person get if 3 people share 1/2 lb of chocolate equally? How many 3/4-cup servings are in 2/3 of a cup of yogurt? How wide is a rectangular strip of land with length 3/4 mi and area 1/2 square mi?</i>.","Number Systems, Operations & Abstract Representation","Number System","NS","Math","http://corestandards.org/Math/Content/6/NS/A/1/","NS.A.1",NA,NA,NA,NA,NA,NA,NA
"6.NS.B.2","Common Core Math","NSO&AR","06","Fluently divide multi-digit numbers using the standard algorithm.","Number Systems, Operations & Abstract Representation","Number System","NS","Math","http://corestandards.org/Math/Content/6/NS/B/2/","NS.B.2",NA,NA,NA,NA,NA,NA,NA
"6.NS.B.3","Common Core Math","NSO&AR","06","Fluently add, subtract, multiply, and divide multi-digit decimals using the standard algorithm for each operation.","Number Systems, Operations & Abstract Representation","Number System","NS","Math","http://corestandards.org/Math/Content/6/NS/B/3/","NS.B.3",NA,NA,NA,NA,NA,NA,NA
"6.NS.B.4","Common Core Math","NSO&AR","06","Find the greatest common factor of two whole numbers less than or equal to 100 and the least common multiple of two whole numbers less than or equal to 12. Use the distributive property to express a sum of two whole numbers 1-100 with a common factor as a multiple of a sum of two whole numbers with no common factor. <i>For example, express 36 + 8 as 4 (9 + 2).</i>.","Number Systems, Operations & Abstract Representation","Number System","NS","Math","http://corestandards.org/Math/Content/6/NS/B/4/","NS.B.4",NA,NA,NA,NA,NA,NA,NA
"6.NS.C.5","Common Core Math","NSO&AR","06","Understand that positive and negative numbers are used together to describe quantities having opposite directions or values (e.g., temperature above/below zero, elevation above/below sea level, credits/debits, positive/negative electric charge); use positive and negative numbers to represent quantities in real-world contexts, explaining the meaning of 0 in each situation.","Number Systems, Operations & Abstract Representation","Number System","NS","Math","http://corestandards.org/Math/Content/6/NS/C/5/","NS.C.5",NA,NA,NA,NA,NA,NA,NA
"6.NS.C.6","Common Core Math","NSO&AR","06","Understand a rational number as a point on the number line. Extend number line diagrams and coordinate axes familiar from previous grades to represent points on the line and in the plane with negative number coordinates.","Number Systems, Operations & Abstract Representation","Number System","NS","Math","http://corestandards.org/Math/Content/6/NS/C/6/","NS.C.6",NA,NA,NA,NA,NA,NA,NA
"6.NS.C.6a","Common Core Math","NSO&AR","06","Recognize opposite signs of numbers as indicating locations on opposite sides of 0 on the number line; recognize that the opposite of the opposite of a number is the number itself, e.g., -(-3) = 3, and that 0 is its own opposite.","Number Systems, Operations & Abstract Representation","Number System","NS","Math","http://corestandards.org/Math/Content/6/NS/C/6/a/","NS.C.6a",NA,NA,NA,NA,NA,NA,NA
"6.NS.C.6b","Common Core Math","NSO&AR","06","Understand signs of numbers in ordered pairs as indicating locations in quadrants of the coordinate plane; recognize that when two ordered pairs differ only by signs, the locations of the points are related by reflections across one or both axes.","Number Systems, Operations & Abstract Representation","Number System","NS","Math","http://corestandards.org/Math/Content/6/NS/C/6/b/","NS.C.6b",NA,NA,NA,NA,NA,NA,NA
"6.NS.C.6c","Common Core Math","NSO&AR","06","Find and position integers and other rational numbers on a horizontal or vertical number line diagram; find and position pairs of integers and other rational numbers on a coordinate plane.","Number Systems, Operations & Abstract Representation","Number System","NS","Math","http://corestandards.org/Math/Content/6/NS/C/6/c/","NS.C.6c",NA,NA,NA,NA,NA,NA,NA
"6.NS.C.7","Common Core Math","NSO&AR","06","Understand ordering and absolute value of rational numbers.","Number Systems, Operations & Abstract Representation","Number System","NS","Math","http://corestandards.org/Math/Content/6/NS/C/7/","NS.C.7",NA,NA,NA,NA,NA,NA,NA
"6.NS.C.7a","Common Core Math","NSO&AR","06","Interpret statements of inequality as statements about the relative position of two numbers on a number line diagram. <i>For example, interpret -3 &gt; -7 as a statement that -3 is located to the right of -7 on a number line oriented from left to right</i>.","Number Systems, Operations & Abstract Representation","Number System","NS","Math","http://corestandards.org/Math/Content/6/NS/C/7/a/","NS.C.7a",NA,NA,NA,NA,NA,NA,NA
"6.NS.C.7b","Common Core Math","NSO&AR","06","Write, interpret, and explain statements of order for rational numbers in real-world contexts. <i>For example, write -3 <sup>o</sup>C &gt; -7 <sup>o</sup>C to express the fact that -3 <sup>o</sup>C is warmer than -7 <sup>o</sup>C</i>.","Number Systems, Operations & Abstract Representation","Number System","NS","Math","http://corestandards.org/Math/Content/6/NS/C/7/b/","NS.C.7b",NA,NA,NA,NA,NA,NA,NA
"6.NS.C.7c","Common Core Math","NSO&AR","06","Understand the absolute value of a rational number as its distance from 0 on the number line; interpret absolute value as magnitude for a positive or negative quantity in a real-world situation. <i>For example, for an account balance of -30 dollars, write |-30| = 30 to describe the size of the debt in dollars</i>.","Number Systems, Operations & Abstract Representation","Number System","NS","Math","http://corestandards.org/Math/Content/6/NS/C/7/c/","NS.C.7c",NA,NA,NA,NA,NA,NA,NA
"6.NS.C.7d","Common Core Math","NSO&AR","06","Distinguish comparisons of absolute value from statements about order. <i>For example, recognize that an account balance less than -30 dollars represents a debt greater than 30 dollars</i>.","Number Systems, Operations & Abstract Representation","Number System","NS","Math","http://corestandards.org/Math/Content/6/NS/C/7/d/","NS.C.7d",NA,NA,NA,NA,NA,NA,NA
"6.NS.C.8","Common Core Math","NSO&AR","06","Solve real-world and mathematical problems by graphing points in all four quadrants of the coordinate plane. Include use of coordinates and absolute value to find distances between points with the same first coordinate or the same second coordinate.","Number Systems, Operations & Abstract Representation","Number System","NS","Math","http://corestandards.org/Math/Content/6/NS/C/8/","NS.C.8",NA,NA,NA,NA,NA,NA,NA
"6.RP.A.1","Common Core Math","NSO&AR","06","Understand the concept of a ratio and use ratio language to describe a ratio relationship between two quantities. <i>For example, ""The ratio of wings to beaks in the bird house at the zoo was 2:1, because for every 2 wings there was 1 beak."" ""For every vote candidate A received, candidate C received nearly three votes.""</i>","Number Systems, Operations & Abstract Representation","Ratios & Proportions","RP","Math","http://corestandards.org/Math/Content/6/RP/A/1/","RP.A.1",NA,NA,NA,NA,NA,NA,NA
"6.RP.A.2","Common Core Math","NSO&AR","06","Understand the concept of a unit rate a/b associated with a ratio a:b with b &ne; 0, and use rate language in the context of a ratio relationship. <i>For example, ""This recipe has a ratio of 3 cups of flour to 4 cups of sugar, so there is 3/4 cup of flour for each cup of sugar."" ""We paid $75 for 15 hamburgers, which is a rate of $5 per hamburger.""</i><sup>1</sup>","Number Systems, Operations & Abstract Representation","Ratios & Proportions","RP","Math","http://corestandards.org/Math/Content/6/RP/A/2/","RP.A.2",NA,NA,NA,NA,NA,NA,NA
"6.RP.A.3","Common Core Math","NSO&AR","06","Use ratio and rate reasoning to solve real-world and mathematical problems, e.g., by reasoning about tables of equivalent ratios, tape diagrams, double number line diagrams, or equations.","Number Systems, Operations & Abstract Representation","Ratios & Proportions","RP","Math","http://corestandards.org/Math/Content/6/RP/A/3/","RP.A.3",NA,NA,NA,NA,NA,NA,NA
"6.RP.A.3a","Common Core Math","NSO&AR","06","Make tables of equivalent ratios relating quantities with whole-number measurements, find missing values in the tables, and plot the pairs of values on the coordinate plane. Use tables to compare ratios.","Number Systems, Operations & Abstract Representation","Ratios & Proportions","RP","Math","http://corestandards.org/Math/Content/6/RP/A/3/a/","RP.A.3a",NA,NA,NA,NA,NA,NA,NA
"6.RP.A.3b","Common Core Math","NSO&AR","06","Solve unit rate problems including those involving unit pricing and constant speed. <i>For example, if it took 7 hours to mow 4 lawns, then at that rate, how many lawns could be mowed in 35 hours? At what rate were lawns being mowed?</i>","Number Systems, Operations & Abstract Representation","Ratios & Proportions","RP","Math","http://corestandards.org/Math/Content/6/RP/A/3/b/","RP.A.3b",NA,NA,NA,NA,NA,NA,NA
"6.RP.A.3c","Common Core Math","NSO&AR","06","Find a percent of a quantity as a rate per 100 (e.g., 30% of a quantity means 30/100 times the quantity); solve problems involving finding the whole, given a part and the percent.","Number Systems, Operations & Abstract Representation","Ratios & Proportions","RP","Math","http://corestandards.org/Math/Content/6/RP/A/3/c/","RP.A.3c",NA,NA,NA,NA,NA,NA,NA
"6.RP.A.3d","Common Core Math","NSO&AR","06","Use ratio reasoning to convert measurement units; manipulate and transform units appropriately when multiplying or dividing quantities.","Number Systems, Operations & Abstract Representation","Ratios & Proportions","RP","Math","http://corestandards.org/Math/Content/6/RP/A/3/d/","RP.A.3d",NA,NA,NA,NA,NA,NA,NA
"6.SP.A.1","Common Core Math","MDP&S","06","Recognize a statistical question as one that anticipates variability in the data related to the question and accounts for it in the answers. <i>For example, ""How old am I?"" is not a statistical question, but ""How old are the students in my school?"" is a statistical question because one anticipates variability in students' ages</i>.","Measurement, Data, Probability & Statistics","Statistics & Probability","SP","Math","http://corestandards.org/Math/Content/6/SP/A/1/","SP.A.1",NA,NA,NA,NA,NA,NA,NA
"6.SP.A.2","Common Core Math","MDP&S","06","Understand that a set of data collected to answer a statistical question has a distribution which can be described by its center, spread, and overall shape.","Measurement, Data, Probability & Statistics","Statistics & Probability","SP","Math","http://corestandards.org/Math/Content/6/SP/A/2/","SP.A.2",NA,NA,NA,NA,NA,NA,NA
"6.SP.A.3","Common Core Math","MDP&S","06","Recognize that a measure of center for a numerical data set summarizes all of its values with a single number, while a measure of variation describes how its values vary with a single number.","Measurement, Data, Probability & Statistics","Statistics & Probability","SP","Math","http://corestandards.org/Math/Content/6/SP/A/3/","SP.A.3",NA,NA,NA,NA,NA,NA,NA
"6.SP.B.4","Common Core Math","MDP&S","06","Display numerical data in plots on a number line, including dot plots, histograms, and box plots.","Measurement, Data, Probability & Statistics","Statistics & Probability","SP","Math","http://corestandards.org/Math/Content/6/SP/B/4/","SP.B.4",NA,NA,NA,NA,NA,NA,NA
"6.SP.B.5","Common Core Math","MDP&S","06","Summarize numerical data sets in relation to their context, such as by:","Measurement, Data, Probability & Statistics","Statistics & Probability","SP","Math","http://corestandards.org/Math/Content/6/SP/B/5/","SP.B.5",NA,NA,NA,NA,NA,NA,NA
"6.SP.B.5a","Common Core Math","MDP&S","06","Reporting the number of observations.","Measurement, Data, Probability & Statistics","Statistics & Probability","SP","Math","http://corestandards.org/Math/Content/6/SP/B/5/a/","SP.B.5a",NA,NA,NA,NA,NA,NA,NA
"6.SP.B.5b","Common Core Math","MDP&S","06","Describing the nature of the attribute under investigation, including how it was measured and its units of measurement.","Measurement, Data, Probability & Statistics","Statistics & Probability","SP","Math","http://corestandards.org/Math/Content/6/SP/B/5/b/","SP.B.5b",NA,NA,NA,NA,NA,NA,NA
"6.SP.B.5c","Common Core Math","MDP&S","06","Giving quantitative measures of center (median and/or mean) and variability (interquartile range and/or mean absolute deviation), as well as describing any overall pattern and any striking deviations from the overall pattern with reference to the context in which the data were gathered.","Measurement, Data, Probability & Statistics","Statistics & Probability","SP","Math","http://corestandards.org/Math/Content/6/SP/B/5/c/","SP.B.5c",NA,NA,NA,NA,NA,NA,NA
"6.SP.B.5d","Common Core Math","MDP&S","06","Relating the choice of measures of center and variability to the shape of the data distribution and the context in which the data were gathered.","Measurement, Data, Probability & Statistics","Statistics & Probability","SP","Math","http://corestandards.org/Math/Content/6/SP/B/5/d/","SP.B.5d",NA,NA,NA,NA,NA,NA,NA
"7.EE.A.1","Common Core Math","AGTC&HLT","07","Apply properties of operations as strategies to add, subtract, factor, and expand linear expressions with rational coefficients.","Algebra, Geometry, Trig, Calculus & Higher Level Thinking","Expressions & Equations","EE","Math","http://corestandards.org/Math/Content/7/EE/A/1/","EE.A.1",NA,NA,NA,NA,NA,NA,NA
"7.EE.A.2","Common Core Math","AGTC&HLT","07","Understand that rewriting an expression in different forms in a problem context can shed light on the problem and how the quantities in it are related. <i>For example, a + 0.05a = 1.05a means that ""increase by 5%"" is the same as ""multiply by 1.05.""</i>","Algebra, Geometry, Trig, Calculus & Higher Level Thinking","Expressions & Equations","EE","Math","http://corestandards.org/Math/Content/7/EE/A/2/","EE.A.2",NA,NA,NA,NA,NA,NA,NA
"7.EE.B.3","Common Core Math","AGTC&HLT","07","Solve multi-step real-life and mathematical problems posed with positive and negative rational numbers in any form (whole numbers, fractions, and decimals), using tools strategically. Apply properties of operations to calculate with numbers in any form; convert between forms as appropriate; and assess the reasonableness of answers using mental computation and estimation strategies. <i>For example: If a woman making $25 an hour gets a 10% raise, she will make an additional 1/10 of her salary an hour, or $2.50, for a new salary of $27.50. If you want to place a towel bar 9 3/4 inches long in the center of a door that is 27 1/2 inches wide, you will need to place the bar about 9 inches from each edge; this estimate can be used as a check on the exact computation</i>.","Algebra, Geometry, Trig, Calculus & Higher Level Thinking","Expressions & Equations","EE","Math","http://corestandards.org/Math/Content/7/EE/B/3/","EE.B.3",NA,NA,NA,NA,NA,NA,NA
"7.EE.B.4","Common Core Math","AGTC&HLT","07","Use variables to represent quantities in a real-world or mathematical problem, and construct simple equations and inequalities to solve problems by reasoning about the quantities.","Algebra, Geometry, Trig, Calculus & Higher Level Thinking","Expressions & Equations","EE","Math","http://corestandards.org/Math/Content/7/EE/B/4/","EE.B.4",NA,NA,NA,NA,NA,NA,NA
"7.EE.B.4a","Common Core Math","AGTC&HLT","07","Solve word problems leading to equations of the form <i>px</i> + <i>q</i> = <i>r</i> and <i>p</i>(<i>x</i> + <i>q</i>) = <i>r</i>, where <i>p</i>, <i>q</i>, and <i>r</i> are specific rational numbers. Solve equations of these forms fluently. Compare an algebraic solution to an arithmetic solution, identifying the sequence of the operations used in each approach. <i>For example, the perimeter of a rectangle is 54 cm. Its length is 6 cm. What is its width?</i>","Algebra, Geometry, Trig, Calculus & Higher Level Thinking","Expressions & Equations","EE","Math","http://corestandards.org/Math/Content/7/EE/B/4/a/","EE.B.4a",NA,NA,NA,NA,NA,NA,NA
"7.EE.B.4b","Common Core Math","AGTC&HLT","07","Solve word problems leading to inequalities of the form <i>px</i> + <i>q</i> &gt; <i>r</i> or <i>px</i> + <i>q</i> &lt; <i>r</i>, where <i>p</i>, <i>q</i>, and <i>r</i> are specific rational numbers. Graph the solution set of the inequality and interpret it in the context of the problem. <i>For example: As a salesperson, you are paid $50 per week plus $3 per sale. This week you want your pay to be at least $100. Write an inequality for the number of sales you need to make, and describe the solutions</i>.","Algebra, Geometry, Trig, Calculus & Higher Level Thinking","Expressions & Equations","EE","Math","http://corestandards.org/Math/Content/7/EE/B/4/b/","EE.B.4b",NA,NA,NA,NA,NA,NA,NA
"7.G.A.1","Common Core Math","AGTC&HLT","07","Solve problems involving scale drawings of geometric figures, including computing actual lengths and areas from a scale drawing and reproducing a scale drawing at a different scale.","Algebra, Geometry, Trig, Calculus & Higher Level Thinking","Geometry","G","Math","http://corestandards.org/Math/Content/7/G/A/1/","G.A.1",NA,NA,NA,NA,NA,NA,NA
"7.G.A.2","Common Core Math","AGTC&HLT","07","Draw (freehand, with ruler and protractor, and with technology) geometric shapes with given conditions. Focus on constructing triangles from three measures of angles or sides, noticing when the conditions determine a unique triangle, more than one triangle, or no triangle.","Algebra, Geometry, Trig, Calculus & Higher Level Thinking","Geometry","G","Math","http://corestandards.org/Math/Content/7/G/A/2/","G.A.2",NA,NA,NA,NA,NA,NA,NA
"7.G.A.3","Common Core Math","AGTC&HLT","07","Describe the two-dimensional figures that result from slicing three-dimensional figures, as in plane sections of right rectangular prisms and right rectangular pyramids.","Algebra, Geometry, Trig, Calculus & Higher Level Thinking","Geometry","G","Math","http://corestandards.org/Math/Content/7/G/A/3/","G.A.3",NA,NA,NA,NA,NA,NA,NA
"7.G.B.4","Common Core Math","AGTC&HLT","07","Know the formulas for the area and circumference of a circle and use them to solve problems; give an informal derivation of the relationship between the circumference and area of a circle.","Algebra, Geometry, Trig, Calculus & Higher Level Thinking","Geometry","G","Math","http://corestandards.org/Math/Content/7/G/B/4/","G.B.4",NA,NA,NA,NA,NA,NA,NA
"7.G.B.5","Common Core Math","AGTC&HLT","07","Use facts about supplementary, complementary, vertical, and adjacent angles in a multi-step problem to write and solve simple equations for an unknown angle in a figure.</li>","Algebra, Geometry, Trig, Calculus & Higher Level Thinking","Geometry","G","Math","http://corestandards.org/Math/Content/7/G/B/5/","G.B.5",NA,NA,NA,NA,NA,NA,NA
"7.G.B.6","Common Core Math","AGTC&HLT","07","Solve real-world and mathematical problems involving area, volume and surface area of two- and three-dimensional objects composed of triangles, quadrilaterals, polygons, cubes, and right prisms.","Algebra, Geometry, Trig, Calculus & Higher Level Thinking","Geometry","G","Math","http://corestandards.org/Math/Content/7/G/B/6/","G.B.6",NA,NA,NA,NA,NA,NA,NA
"7.NS.A.1","Common Core Math","NSO&AR","07","Apply and extend previous understandings of addition and subtraction to add and subtract rational numbers; represent addition and subtraction on a horizontal or vertical number line diagram.","Number Systems, Operations & Abstract Representation","Number System","NS","Math","http://corestandards.org/Math/Content/7/NS/A/1/","NS.A.1",NA,NA,NA,NA,NA,NA,NA
"7.NS.A.1a","Common Core Math","NSO&AR","07","Describe situations in which opposite quantities combine to make 0. <i>For example, a hydrogen atom has 0 charge because its two constituents are oppositely charged</i>.","Number Systems, Operations & Abstract Representation","Number System","NS","Math","http://corestandards.org/Math/Content/7/NS/A/1/a/","NS.A.1a",NA,NA,NA,NA,NA,NA,NA
"7.NS.A.1b","Common Core Math","NSO&AR","07","Understand <i>p</i> + <i>q</i> as the number located a distance |<i>q</i>| from <i>p</i>, in the positive or negative direction depending on whether <i>q</i> is positive or negative. Show that a number and its opposite have a sum of 0 (are additive inverses). Interpret sums of rational numbers by describing real-world contexts.","Number Systems, Operations & Abstract Representation","Number System","NS","Math","http://corestandards.org/Math/Content/7/NS/A/1/b/","NS.A.1b",NA,NA,NA,NA,NA,NA,NA
"7.NS.A.1c","Common Core Math","NSO&AR","07","Understand subtraction of rational numbers as adding the additive inverse, <i>p</i> - <i>q</i> = <i>p</i> + (-<i>q</i>). Show that the distance between two rational numbers on the number line is the absolute value of their difference, and apply this principle in real-world contexts.","Number Systems, Operations & Abstract Representation","Number System","NS","Math","http://corestandards.org/Math/Content/7/NS/A/1/c/","NS.A.1c",NA,NA,NA,NA,NA,NA,NA
"7.NS.A.1d","Common Core Math","NSO&AR","07","Apply properties of operations as strategies to add and subtract rational numbers.","Number Systems, Operations & Abstract Representation","Number System","NS","Math","http://corestandards.org/Math/Content/7/NS/A/1/d/","NS.A.1d",NA,NA,NA,NA,NA,NA,NA
