"code","set","dim","grade","statement","dimension","orig_dimension","orig_dim","subject","link","code2","subcategory","subcat","PEcode","performanceExpectation","clarifyingStatement","assessmentBoundary","goal"
"D1.1.3-5","C3","DQPI","3,4,5","Explain why compelling questions are important to others (e.g., peers, adults).","Developing Questions & Planning Inquiries","Developing Questions & Planning Inquiries","DQPI","Social Studies",NA,NA,NA,NA,NA,NA,NA,NA,NA
"D1.1.6-8","C3","DQPI","6,7,8","Explain how a question represents key ideas in the field.","Developing Questions & Planning Inquiries","Developing Questions & Planning Inquiries","DQPI","Social Studies",NA,NA,NA,NA,NA,NA,NA,NA,NA
"D1.1.9-12","C3","DQPI","9,10,11,12","Explain how a question reflects an enduring issue in the field.","Developing Questions & Planning Inquiries","Developing Questions & Planning Inquiries","DQPI","Social Studies",NA,NA,NA,NA,NA,NA,NA,NA,NA
"D1.1.K-2","C3","DQPI","K,1,2","Explain why the compelling question is important to the student.","Developing Questions & Planning Inquiries","Developing Questions & Planning Inquiries","DQPI","Social Studies",NA,NA,NA,NA,NA,NA,NA,NA,NA
"D1.2.3-5","C3","DQPI","3,4,5","Identify disciplinary concepts and ideas associated with a compelling question that are open to different interpretations.","Developing Questions & Planning Inquiries","Developing Questions & Planning Inquiries","DQPI","Social Studies",NA,NA,NA,NA,NA,NA,NA,NA,NA
"D1.2.6-8","C3","DQPI","6,7,8","Explain points of agreement experts have about interpretations and applications of disciplinary concepts and ideas associated with a compelling question.","Developing Questions & Planning Inquiries","Developing Questions & Planning Inquiries","DQPI","Social Studies",NA,NA,NA,NA,NA,NA,NA,NA,NA
"D1.2.9-12","C3","DQPI","9,10,11,12","Explain points of agreement and disagreement experts have about interpretations and applications of disciplinary concepts and ideas associated with a compelling question.","Developing Questions & Planning Inquiries","Developing Questions & Planning Inquiries","DQPI","Social Studies",NA,NA,NA,NA,NA,NA,NA,NA,NA
"D1.2.K-2","C3","DQPI","K,1,2","Identify disciplinary ideas associated with a compelling question.","Developing Questions & Planning Inquiries","Developing Questions & Planning Inquiries","DQPI","Social Studies",NA,NA,NA,NA,NA,NA,NA,NA,NA
"D1.3.3-5","C3","DQPI","3,4,5","Identify the disciplinary concepts and ideas associated with a supporting question that are open to interpretation.","Developing Questions & Planning Inquiries","Developing Questions & Planning Inquiries","DQPI","Social Studies",NA,NA,NA,NA,NA,NA,NA,NA,NA
"D1.3.6-8","C3","DQPI","6,7,8","Explain points of agreement experts have about interpretations and applications of disciplinary concepts and ideas associated with a supporting question.","Developing Questions & Planning Inquiries","Developing Questions & Planning Inquiries","DQPI","Social Studies",NA,NA,NA,NA,NA,NA,NA,NA,NA
"D1.3.9-12","C3","DQPI","9,10,11,12","Explain points of agreement and disagreement experts have about interpretations and applications of disciplinary concepts and ideas associated with a supporting question.","Developing Questions & Planning Inquiries","Developing Questions & Planning Inquiries","DQPI","Social Studies",NA,NA,NA,NA,NA,NA,NA,NA,NA
"D1.3.K-2","C3","DQPI","K,1,2","Identify facts and concepts associated with a supporting question.","Developing Questions & Planning Inquiries","Developing Questions & Planning Inquiries","DQPI","Social Studies",NA,NA,NA,NA,NA,NA,NA,NA,NA
"D1.4.3-5","C3","DQPI","3,4,5","Explain how supporting questions help answer compelling questions in an inquiry.","Developing Questions & Planning Inquiries","Developing Questions & Planning Inquiries","DQPI","Social Studies",NA,NA,NA,NA,NA,NA,NA,NA,NA
"D1.4.6-8","C3","DQPI","6,7,8","Explain how the relationship between supporting questions and compelling questions is mutually reinforcing.","Developing Questions & Planning Inquiries","Developing Questions & Planning Inquiries","DQPI","Social Studies",NA,NA,NA,NA,NA,NA,NA,NA,NA
"D1.4.9-12","C3","DQPI","9,10,11,12","Explain how supporting questions contribute to an inquiry and how, through engaging source work, new compelling and supporting questions emerge.","Developing Questions & Planning Inquiries","Developing Questions & Planning Inquiries","DQPI","Social Studies",NA,NA,NA,NA,NA,NA,NA,NA,NA
"D1.4.K-2","C3","DQPI","K,1,2","Make connections between supporting questions and compelling questions.","Developing Questions & Planning Inquiries","Developing Questions & Planning Inquiries","DQPI","Social Studies",NA,NA,NA,NA,NA,NA,NA,NA,NA
"D2.Civ.1.3-5","C3","CEGH","3,4,5","Distinguish the responsibilities and powers of government officials at various levels and branches of government and in different times and places.","Civics, Economics, Geography & History","Applying Disciplinary Concepts & Tools","ADCT","Social Studies",NA,NA,NA,NA,NA,NA,NA,NA,NA
"D2.Civ.1.6-8","C3","CEGH","6,7,8","Distinguish the powers and responsibilities of citizens, political parties, interest groups, and the media in a variety of governmental and nongovernmental contexts.","Civics, Economics, Geography & History","Applying Disciplinary Concepts & Tools","ADCT","Social Studies",NA,NA,NA,NA,NA,NA,NA,NA,NA
"D2.Civ.1.9-12","C3","CEGH","9,10,11,12","Distinguish the powers and responsibilities of local, state, tribal, national, and international civic and political institutions.","Civics, Economics, Geography & History","Applying Disciplinary Concepts & Tools","ADCT","Social Studies",NA,NA,NA,NA,NA,NA,NA,NA,NA
"D2.Civ.1.K-2","C3","CEGH","K,1,2","Describe roles and responsibilities of people in authority.","Civics, Economics, Geography & History","Applying Disciplinary Concepts & Tools","ADCT","Social Studies",NA,NA,NA,NA,NA,NA,NA,NA,NA
"D2.Civ.10.3-5","C3","CEGH","3,4,5","Identify the beliefs, experiences, perspectives, and values that underlie their own and others’ points of view about civic issues.","Civics, Economics, Geography & History","Applying Disciplinary Concepts & Tools","ADCT","Social Studies",NA,NA,NA,NA,NA,NA,NA,NA,NA
"D2.Civ.10.6-8","C3","CEGH","6,7,8","Explain the relevance of personal interests and perspectives, civic virtues, and democratic principles when people address issues and problems in government and civil society.","Civics, Economics, Geography & History","Applying Disciplinary Concepts & Tools","ADCT","Social Studies",NA,NA,NA,NA,NA,NA,NA,NA,NA
"D2.Civ.10.9-12","C3","CEGH","9,10,11,12","Analyze the impact and the appropriate roles of personal interests and perspectives on the application of civic virtues, democratic principles, constitutional rights, and human rights.","Civics, Economics, Geography & History","Applying Disciplinary Concepts & Tools","ADCT","Social Studies",NA,NA,NA,NA,NA,NA,NA,NA,NA
"D2.Civ.10.K-2","C3","CEGH","K,1,2","Compare their own point of view with others’ perspectives.","Civics, Economics, Geography & History","Applying Disciplinary Concepts & Tools","ADCT","Social Studies",NA,NA,NA,NA,NA,NA,NA,NA,NA
"D2.Civ.11.3-5","C3","CEGH","3,4,5","Compare procedures for making decisions in a variety of settings, including classroom, school, government, and/or society.","Civics, Economics, Geography & History","Applying Disciplinary Concepts & Tools","ADCT","Social Studies",NA,NA,NA,NA,NA,NA,NA,NA,NA
"D2.Civ.11.6-8","C3","CEGH","6,7,8","Differentiate among procedures for making decisions in the classroom, school, civil society, and local, state, and national government in terms of how civic purposes are intended.","Civics, Economics, Geography & History","Applying Disciplinary Concepts & Tools","ADCT","Social Studies",NA,NA,NA,NA,NA,NA,NA,NA,NA
"D2.Civ.11.9-12","C3","CEGH","9,10,11,12","Evaluate multiple procedures for making governmental decisions at the local, state, national, and international levels in terms of the civic purposes achieved.","Civics, Economics, Geography & History","Applying Disciplinary Concepts & Tools","ADCT","Social Studies",NA,NA,NA,NA,NA,NA,NA,NA,NA
"D2.Civ.11.K-2","C3","CEGH","K,1,2","Explain how people can work together to make decisions in the classroom.","Civics, Economics, Geography & History","Applying Disciplinary Concepts & Tools","ADCT","Social Studies",NA,NA,NA,NA,NA,NA,NA,NA,NA
"D2.Civ.12.3-5","C3","CEGH","3,4,5","Explain how rules and laws change society and how people change rules and laws.","Civics, Economics, Geography & History","Applying Disciplinary Concepts & Tools","ADCT","Social Studies",NA,NA,NA,NA,NA,NA,NA,NA,NA
"D2.Civ.12.6-8","C3","CEGH","6,7,8","Assess specific rules and laws (both actual and proposed) as means of addressing public problems.","Civics, Economics, Geography & History","Applying Disciplinary Concepts & Tools","ADCT","Social Studies",NA,NA,NA,NA,NA,NA,NA,NA,NA
"D2.Civ.12.9-12","C3","CEGH","9,10,11,12","Analyze how people use and challenge local, state, national, and international laws to address a variety of public issues.","Civics, Economics, Geography & History","Applying Disciplinary Concepts & Tools","ADCT","Social Studies",NA,NA,NA,NA,NA,NA,NA,NA,NA
"D2.Civ.12.K-2","C3","CEGH","K,1,2","Identify and explain how rules function in public (classroom and school) settings.","Civics, Economics, Geography & History","Applying Disciplinary Concepts & Tools","ADCT","Social Studies",NA,NA,NA,NA,NA,NA,NA,NA,NA
"D2.Civ.13.3-5","C3","CEGH","3,4,5","Explain how policies are developed to address public problems.","Civics, Economics, Geography & History","Applying Disciplinary Concepts & Tools","ADCT","Social Studies",NA,NA,NA,NA,NA,NA,NA,NA,NA
"D2.Civ.13.6-8","C3","CEGH","6,7,8","Analyze the purposes, implementation, and consequences of public policies in multiple settings.","Civics, Economics, Geography & History","Applying Disciplinary Concepts & Tools","ADCT","Social Studies",NA,NA,NA,NA,NA,NA,NA,NA,NA
"D2.Civ.13.9-12","C3","CEGH","9,10,11,12","Evaluate public policies in terms of intended and unintended outcomes, and related consequences.","Civics, Economics, Geography & History","Applying Disciplinary Concepts & Tools","ADCT","Social Studies",NA,NA,NA,NA,NA,NA,NA,NA,NA
"D2.Civ.14.3-5","C3","CEGH","3,4,5","Illustrate historical and contemporary means of changing society.","Civics, Economics, Geography & History","Applying Disciplinary Concepts & Tools","ADCT","Social Studies",NA,NA,NA,NA,NA,NA,NA,NA,NA
"D2.Civ.14.6-8","C3","CEGH","6,7,8","Compare historical and contemporary means of changing societies, and promoting the common good.","Civics, Economics, Geography & History","Applying Disciplinary Concepts & Tools","ADCT","Social Studies",NA,NA,NA,NA,NA,NA,NA,NA,NA
"D2.Civ.14.9-12","C3","CEGH","9,10,11,12","Analyze historical, contemporary, and emerging means of changing societies, promoting the common good, and protecting rights.","Civics, Economics, Geography & History","Applying Disciplinary Concepts & Tools","ADCT","Social Studies",NA,NA,NA,NA,NA,NA,NA,NA,NA
"D2.Civ.14.K-2","C3","CEGH","K,1,2","Describe how people have tried to improve their communities over time.","Civics, Economics, Geography & History","Applying Disciplinary Concepts & Tools","ADCT","Social Studies",NA,NA,NA,NA,NA,NA,NA,NA,NA
"D2.Civ.2.3-5","C3","CEGH","3,4,5","Explain how a democracy relies on people’s responsible participation, and draw implications for how individuals should participate.","Civics, Economics, Geography & History","Applying Disciplinary Concepts & Tools","ADCT","Social Studies",NA,NA,NA,NA,NA,NA,NA,NA,NA
"D2.Civ.2.6-8","C3","CEGH","6,7,8","Explain specific roles played by citizens (such as voters, jurors, taxpayers, members of the armed forces, petitioners, protesters, and office-holders).","Civics, Economics, Geography & History","Applying Disciplinary Concepts & Tools","ADCT","Social Studies",NA,NA,NA,NA,NA,NA,NA,NA,NA
"D2.Civ.2.9-12","C3","CEGH","9,10,11,12","Analyze the role of citizens in the U.S","Civics, Economics, Geography & History","Applying Disciplinary Concepts & Tools","ADCT","Social Studies",NA,NA,NA,NA,NA,NA,NA,NA,NA
"D2.Civ.2.K-2","C3","CEGH","K,1,2","Explain how all people, not just official leaders, play important roles in a community.","Civics, Economics, Geography & History","Applying Disciplinary Concepts & Tools","ADCT","Social Studies",NA,NA,NA,NA,NA,NA,NA,NA,NA
"D2.Civ.3.3-5","C3","CEGH","3,4,5","Examine the origins and purposes of rules, laws, and key U.S","Civics, Economics, Geography & History","Applying Disciplinary Concepts & Tools","ADCT","Social Studies",NA,NA,NA,NA,NA,NA,NA,NA,NA
"D2.Civ.3.6-8","C3","CEGH","6,7,8","Examine the origins, purposes, and impact of constitutions, laws, treaties, and international agreements.","Civics, Economics, Geography & History","Applying Disciplinary Concepts & Tools","ADCT","Social Studies",NA,NA,NA,NA,NA,NA,NA,NA,NA
"D2.Civ.3.9-12","C3","CEGH","9,10,11,12","Analyze the impact of constitutions, laws, treaties, and international agreements on the maintenance of national and international order.","Civics, Economics, Geography & History","Applying Disciplinary Concepts & Tools","ADCT","Social Studies",NA,NA,NA,NA,NA,NA,NA,NA,NA
"D2.Civ.3.K-2","C3","CEGH","K,1,2","Explain the need for and purposes of rules in various settings inside and outside of school.","Civics, Economics, Geography & History","Applying Disciplinary Concepts & Tools","ADCT","Social Studies",NA,NA,NA,NA,NA,NA,NA,NA,NA
"D2.Civ.4.3-5","C3","CEGH","3,4,5","Explain how groups of people make rules to create responsibilities and protect freedoms.","Civics, Economics, Geography & History","Applying Disciplinary Concepts & Tools","ADCT","Social Studies",NA,NA,NA,NA,NA,NA,NA,NA,NA
"D2.Civ.4.6-8","C3","CEGH","6,7,8","Explain the powers and limits of the three branches of government, public officials, and bureaucracies at different levels in the United States and in other countries.","Civics, Economics, Geography & History","Applying Disciplinary Concepts & Tools","ADCT","Social Studies",NA,NA,NA,NA,NA,NA,NA,NA,NA
"D2.Civ.4.9-12","C3","CEGH","9,10,11,12","Explain how the U.S","Civics, Economics, Geography & History","Applying Disciplinary Concepts & Tools","ADCT","Social Studies",NA,NA,NA,NA,NA,NA,NA,NA,NA
"D2.Civ.4.K-2","C3","CEGH","K,1,2","Begins in grades 3–5","Civics, Economics, Geography & History","Applying Disciplinary Concepts & Tools","ADCT","Social Studies",NA,NA,NA,NA,NA,NA,NA,NA,NA
"D2.Civ.5.3-5","C3","CEGH","3,4,5","Explain the origins, functions, and structure of different systems of government, including those created by the U.S","Civics, Economics, Geography & History","Applying Disciplinary Concepts & Tools","ADCT","Social Studies",NA,NA,NA,NA,NA,NA,NA,NA,NA
"D2.Civ.5.6-8","C3","CEGH","6,7,8","Explain the origins, functions, and structure of government with reference to the U.S","Civics, Economics, Geography & History","Applying Disciplinary Concepts & Tools","ADCT","Social Studies",NA,NA,NA,NA,NA,NA,NA,NA,NA
"D2.Civ.5.9-12","C3","CEGH","9,10,11,12","Evaluate citizens’ and institutions’ effectiveness in addressing social and political problems at the local, state, tribal, national, and/or international level.","Civics, Economics, Geography & History","Applying Disciplinary Concepts & Tools","ADCT","Social Studies",NA,NA,NA,NA,NA,NA,NA,NA,NA
"D2.Civ.5.K-2","C3","CEGH","K,1,2","Explain what governments are and some of their functions.","Civics, Economics, Geography & History","Applying Disciplinary Concepts & Tools","ADCT","Social Studies",NA,NA,NA,NA,NA,NA,NA,NA,NA
"D2.Civ.6.3-5","C3","CEGH","3,4,5","Describe ways in which people benefit from and are challenged by working together, including through government, workplaces, voluntary organizations, and families.","Civics, Economics, Geography & History","Applying Disciplinary Concepts & Tools","ADCT","Social Studies",NA,NA,NA,NA,NA,NA,NA,NA,NA
"D2.Civ.6.6-8","C3","CEGH","6,7,8","Describe the roles of political, civil, and economic organizations in shaping people’s lives.","Civics, Economics, Geography & History","Applying Disciplinary Concepts & Tools","ADCT","Social Studies",NA,NA,NA,NA,NA,NA,NA,NA,NA
"D2.Civ.6.9-12","C3","CEGH","9,10,11,12","Critique relationships among governments, civil societies, and economic markets.","Civics, Economics, Geography & History","Applying Disciplinary Concepts & Tools","ADCT","Social Studies",NA,NA,NA,NA,NA,NA,NA,NA,NA
"D2.Civ.6.K-2","C3","CEGH","K,1,2","Describe how communities work to accomplish common tasks, establish responsibilities, and fulfill roles of authority.","Civics, Economics, Geography & History","Applying Disciplinary Concepts & Tools","ADCT","Social Studies",NA,NA,NA,NA,NA,NA,NA,NA,NA
"D2.Civ.7.3-5","C3","CEGH","3,4,5","Apply civic virtues and democratic principles in school settings.","Civics, Economics, Geography & History","Applying Disciplinary Concepts & Tools","ADCT","Social Studies",NA,NA,NA,NA,NA,NA,NA,NA,NA
"D2.Civ.7.6-8","C3","CEGH","6,7,8","Apply civic virtues and democratic principles in school and community settings.","Civics, Economics, Geography & History","Applying Disciplinary Concepts & Tools","ADCT","Social Studies",NA,NA,NA,NA,NA,NA,NA,NA,NA
"D2.Civ.7.9-12","C3","CEGH","9,10,11,12","Apply civic virtues and democratic principles when working with others.","Civics, Economics, Geography & History","Applying Disciplinary Concepts & Tools","ADCT","Social Studies",NA,NA,NA,NA,NA,NA,NA,NA,NA
"D2.Civ.7.K-2","C3","CEGH","K,1,2","Apply civic virtues when participating in school settings.","Civics, Economics, Geography & History","Applying Disciplinary Concepts & Tools","ADCT","Social Studies",NA,NA,NA,NA,NA,NA,NA,NA,NA
"D2.Civ.8.3-5","C3","CEGH","3,4,5","Identify core civic virtues and democratic principles that guide government, society, and communities.","Civics, Economics, Geography & History","Applying Disciplinary Concepts & Tools","ADCT","Social Studies",NA,NA,NA,NA,NA,NA,NA,NA,NA
"D2.Civ.8.6-8","C3","CEGH","6,7,8","Analyze ideas and principles contained in the founding documents of the United States, and explain how they influence the social and political system.","Civics, Economics, Geography & History","Applying Disciplinary Concepts & Tools","ADCT","Social Studies",NA,NA,NA,NA,NA,NA,NA,NA,NA
"D2.Civ.8.9-12","C3","CEGH","9,10,11,12","Evaluate social and political systems in different contexts, times, and places, that promote civic virtues and enact democratic principles.","Civics, Economics, Geography & History","Applying Disciplinary Concepts & Tools","ADCT","Social Studies",NA,NA,NA,NA,NA,NA,NA,NA,NA
"D2.Civ.8.K-2","C3","CEGH","K,1,2","Describe democratic principles such as equality, fairness, and respect for legitimate authority and rules.","Civics, Economics, Geography & History","Applying Disciplinary Concepts & Tools","ADCT","Social Studies",NA,NA,NA,NA,NA,NA,NA,NA,NA
"D2.Civ.9.3-5","C3","CEGH","3,4,5","Use deliberative processes when making decisions or reaching judgments as a group.","Civics, Economics, Geography & History","Applying Disciplinary Concepts & Tools","ADCT","Social Studies",NA,NA,NA,NA,NA,NA,NA,NA,NA
"D2.Civ.9.6-8","C3","CEGH","6,7,8","Compare deliberative processes used by a wide variety of groups in various settings.","Civics, Economics, Geography & History","Applying Disciplinary Concepts & Tools","ADCT","Social Studies",NA,NA,NA,NA,NA,NA,NA,NA,NA
"D2.Civ.9.9-12","C3","CEGH","9,10,11,12","Use appropriate deliberative processes in multiple settings.","Civics, Economics, Geography & History","Applying Disciplinary Concepts & Tools","ADCT","Social Studies",NA,NA,NA,NA,NA,NA,NA,NA,NA
"D2.Civ.9.K-2","C3","CEGH","K,1,2","Follow agreed-upon rules for discussions while responding attentively to others when addressing ideas and making decisions as a group.","Civics, Economics, Geography & History","Applying Disciplinary Concepts & Tools","ADCT","Social Studies",NA,NA,NA,NA,NA,NA,NA,NA,NA
"D2.Eco.1.3-5","C3","CEGH","3,4,5","Compare the benefits and costs of individual choices.","Civics, Economics, Geography & History","Applying Disciplinary Concepts & Tools","ADCT","Social Studies",NA,NA,NA,NA,NA,NA,NA,NA,NA
"D2.Eco.1.6-8","C3","CEGH","6,7,8","Explain how economic decisions affect the well-being of individuals, businesses, and society.","Civics, Economics, Geography & History","Applying Disciplinary Concepts & Tools","ADCT","Social Studies",NA,NA,NA,NA,NA,NA,NA,NA,NA
"D2.Eco.1.9-12","C3","CEGH","9,10,11,12","Analyze how incentives influence choices that may result in policies with a range of costs and benefits for different groups.","Civics, Economics, Geography & History","Applying Disciplinary Concepts & Tools","ADCT","Social Studies",NA,NA,NA,NA,NA,NA,NA,NA,NA
"D2.Eco.1.K-2","C3","CEGH","K,1,2","Explain how scarcity necessitates decision making.","Civics, Economics, Geography & History","Applying Disciplinary Concepts & Tools","ADCT","Social Studies",NA,NA,NA,NA,NA,NA,NA,NA,NA
"D2.Eco.10.3-5","C3","CEGH","3,4,5","Explain what interest rates are.","Civics, Economics, Geography & History","Applying Disciplinary Concepts & Tools","ADCT","Social Studies",NA,NA,NA,NA,NA,NA,NA,NA,NA
"D2.Eco.10.6-8","C3","CEGH","6,7,8","Explain the influence of changes in interest rates on borrowing and investing.","Civics, Economics, Geography & History","Applying Disciplinary Concepts & Tools","ADCT","Social Studies",NA,NA,NA,NA,NA,NA,NA,NA,NA
"D2.Eco.10.9-12","C3","CEGH","9,10,11,12","Use current data to explain the influence of changes in spending, production, and the money supply on various economic conditions.","Civics, Economics, Geography & History","Applying Disciplinary Concepts & Tools","ADCT","Social Studies",NA,NA,NA,NA,NA,NA,NA,NA,NA
"D2.Eco.10.K-2","C3","CEGH","K,1,2","Explain why people save.","Civics, Economics, Geography & History","Applying Disciplinary Concepts & Tools","ADCT","Social Studies",NA,NA,NA,NA,NA,NA,NA,NA,NA
"D2.Eco.11.3-5","C3","CEGH","3,4,5","Explain the meaning of inflation, deflation, and unemployment.","Civics, Economics, Geography & History","Applying Disciplinary Concepts & Tools","ADCT","Social Studies",NA,NA,NA,NA,NA,NA,NA,NA,NA
"D2.Eco.11.6-8","C3","CEGH","6,7,8","Use appropriate data to evaluate the state of employment, unemployment, inflation, total production, income, and economic growth in the economy.","Civics, Economics, Geography & History","Applying Disciplinary Concepts & Tools","ADCT","Social Studies",NA,NA,NA,NA,NA,NA,NA,NA,NA
"D2.Eco.11.9-12","C3","CEGH","9,10,11,12","Use economic indicators to analyze the current and future state of the economy.","Civics, Economics, Geography & History","Applying Disciplinary Concepts & Tools","ADCT","Social Studies",NA,NA,NA,NA,NA,NA,NA,NA,NA
"D2.Eco.12.3-5","C3","CEGH","3,4,5","Explain the ways in which the government pays for the goods and services it provides.","Civics, Economics, Geography & History","Applying Disciplinary Concepts & Tools","ADCT","Social Studies",NA,NA,NA,NA,NA,NA,NA,NA,NA
"D2.Eco.12.6-8","C3","CEGH","6,7,8","Explain how inflation, deflation, and unemployment affect different groups.","Civics, Economics, Geography & History","Applying Disciplinary Concepts & Tools","ADCT","Social Studies",NA,NA,NA,NA,NA,NA,NA,NA,NA
"D2.Eco.12.9-12","C3","CEGH","9,10,11,12","Evaluate the selection of monetary and fiscal policies in a variety of economic conditions.","Civics, Economics, Geography & History","Applying Disciplinary Concepts & Tools","ADCT","Social Studies",NA,NA,NA,NA,NA,NA,NA,NA,NA
"D2.Eco.12.K-2","C3","CEGH","K,1,2","Describe examples of the goods and services that governments provide.","Civics, Economics, Geography & History","Applying Disciplinary Concepts & Tools","ADCT","Social Studies",NA,NA,NA,NA,NA,NA,NA,NA,NA
"D2.Eco.13.3-5","C3","CEGH","3,4,5","Describe ways people can increase productivity by using improved capital goods and improving their human capital.","Civics, Economics, Geography & History","Applying Disciplinary Concepts & Tools","ADCT","Social Studies",NA,NA,NA,NA,NA,NA,NA,NA,NA
"D2.Eco.13.6-8","C3","CEGH","6,7,8","Explain why standards of living increase as productivity improves.","Civics, Economics, Geography & History","Applying Disciplinary Concepts & Tools","ADCT","Social Studies",NA,NA,NA,NA,NA,NA,NA,NA,NA
"D2.Eco.13.9-12","C3","CEGH","9,10,11,12","Explain why advancements in technology and investments in capital goods and human capital increase economic growth and standards of living.","Civics, Economics, Geography & History","Applying Disciplinary Concepts & Tools","ADCT","Social Studies",NA,NA,NA,NA,NA,NA,NA,NA,NA
"D2.Eco.13.K-2","C3","CEGH","K,1,2","Describe examples of capital goods and human capital.","Civics, Economics, Geography & History","Applying Disciplinary Concepts & Tools","ADCT","Social Studies",NA,NA,NA,NA,NA,NA,NA,NA,NA
"D2.Eco.14.3-5","C3","CEGH","3,4,5","Explain how trade leads to increasing economic interdependence among nations.","Civics, Economics, Geography & History","Applying Disciplinary Concepts & Tools","ADCT","Social Studies",NA,NA,NA,NA,NA,NA,NA,NA,NA
"D2.Eco.14.6-8","C3","CEGH","6,7,8","Explain barriers to trade and how those barriers influence trade among nations.","Civics, Economics, Geography & History","Applying Disciplinary Concepts & Tools","ADCT","Social Studies",NA,NA,NA,NA,NA,NA,NA,NA,NA
"D2.Eco.14.9-12","C3","CEGH","9,10,11,12","Analyze the role of comparative advantage in international trade of goods and services.","Civics, Economics, Geography & History","Applying Disciplinary Concepts & Tools","ADCT","Social Studies",NA,NA,NA,NA,NA,NA,NA,NA,NA
"D2.Eco.14.K-2","C3","CEGH","K,1,2","Describe why people in one country trade goods and services with people in other countries.","Civics, Economics, Geography & History","Applying Disciplinary Concepts & Tools","ADCT","Social Studies",NA,NA,NA,NA,NA,NA,NA,NA,NA
