"code","set","dim","grade","statement","dimension","orig_dimension","orig_dim","subject","link","code2","subcategory","subcat","PEcode","performanceExpectation","clarifyingStatement","assessmentBoundary","goal"
"PS2.B-E1","NGSS","DCI","3,4,5","Objects in contact exert forces on each other.","Disciplinary Core ideas",NA,NA,"Science",NA,NA,"Types of Interactions","PS2.B","3-PS2-1","Plan and conduct an investigation to provide evidence of the effects of balanced and unbalanced forces on the motion of an object.","Examples could include an unbalanced force on one side of a ball can make it start moving; and, balanced forces pushing on a box from both sides will not produce any motion at all.","Assessment is limited to one variable at a time: number, size, or direction of forces. Assessment does not include quantitative force size, only qualitative and relative. Assessment is limited to gravity being addressed as a force that pulls objects down.",NA
"PS2.B-E2","NGSS","DCI","3,4,5","Electric and magnetic forces between a pair of objects do not require that the objects be in contact. The sizes of the forces in each situation depend on the properties of the objects and their distances apart and, for forces between two magnets, on their orientation relative to each other.","Disciplinary Core ideas",NA,NA,"Science",NA,NA,"Types of Interactions","PS2.B","3-PS2-1","Plan and conduct an investigation to provide evidence of the effects of balanced and unbalanced forces on the motion of an object.","Examples could include an unbalanced force on one side of a ball can make it start moving; and, balanced forces pushing on a box from both sides will not produce any motion at all.","Assessment is limited to one variable at a time: number, size, or direction of forces. Assessment does not include quantitative force size, only qualitative and relative. Assessment is limited to gravity being addressed as a force that pulls objects down.",NA
"PS2.B-E3","NGSS","DCI","3,4,5","The gravitational force of Earth acting on an object near Earth's surface pulls that object toward the planet's center.","Disciplinary Core ideas",NA,NA,"Science",NA,NA,"Types of Interactions","PS2.B","5-PS2-1","Support an argument that the gravitational force exerted by Earth on objects is directed down.","“Down” is a local description of the direction that points toward the center of the spherical Earth.","Assessment does not include mathematical representation of gravitational force.",NA
"PS2.B-M1","NGSS","DCI","6,7,8","Electric and magnetic (electromagnetic) forces can be attractive or repulsive, and their sizes depend on the magnitudes of the charges, currents, or magnetic strengths involved and on the distances between the interacting objects..","Disciplinary Core ideas",NA,NA,"Science",NA,NA,"Types of Interactions","PS2.B","MS-PS2-3","Ask questions about data to determine the factors that affect the strength of electric and magnetic forces.","Examples of devices that use electric and magnetic forces could include electromagnets, electric motors, or generators. Examples of data could include the effect of the number of turns of wire on the strength of an electromagnet, or the effect of increasing the number or strength of magnets on the speed of an electric motor.","Assessment about questions that require quantitative answers is limited to proportional reasoning and algebraic thinking.",NA
"PS2.B-M2","NGSS","DCI","6,7,8","Gravitational forces are always attractive. There is a gravitational force between any two masses, but it is very small except when one or both of the objects have large mass (e.g., Earth and the Sun).","Disciplinary Core ideas",NA,NA,"Science",NA,NA,"Types of Interactions","PS2.B","MS-PS2-4","Construct and present arguments using evidence to support the claim that gravitational interactions are attractive and depend on the masses of interacting objects.","Examples of evidence for arguments could include data generated from simulations or digital tools; and charts displaying mass, strength of interaction, distance from the Sun, and orbital periods of objects within the solar system.","Assessment does not include Newton’s Law of Gravitation or Kepler’s Laws.",NA
"PS2.B-M3","NGSS","DCI","6,7,8","Forces that act at a distance (electric, magnetic, and gravitational) can be explained by fields that extend through space and can be mapped by their effect on a test object (a charged object, a magnet, or a ball, respectively).","Disciplinary Core ideas",NA,NA,"Science",NA,NA,"Types of Interactions","PS2.B","MS-PS2-5","Conduct an investigation and evaluate the experimental design to provide evidence that fields exist between objects exerting forces on each other even though the objects are not in contact.","Examples of this phenomenon could include the interactions of magnets, electrically-charged strips of tape, and electrically-charged pith balls. Examples of investigations could include first-hand experiences or simulations.","Assessment is limited to electric and magnetic fields, and limited to qualitative evidence for the existence of fields.",NA
"PS2.B-H1","NGSS","DCI","9,10,11,12","Newton's law of universal gravitation and Coulomb's law provide the mathematical models to describe and predict the effects of gravitational and electrostatic forces between distant objects.","Disciplinary Core ideas",NA,NA,"Science",NA,NA,"Types of Interactions","PS2.B","HS-PS2-4","Use mathematical representations of Newton’s Law of Gravitation and Coulomb’s Law to describe and predict the gravitational and electrostatic forces between objects.","Emphasis is on both quantitative and conceptual descriptions of gravitational and electric fields.","Assessment is limited to systems with two objects.",NA
"PS2.B-H2","NGSS","DCI","9,10,11,12","Forces at a distance are explained by fields (gravitational, electric, and magnetic) permeating space that can transfer energy through space. Magnets or electric currents cause magnetic fields; electric charges or changing magnetic fields cause electric fields.","Disciplinary Core ideas",NA,NA,"Science",NA,NA,"Types of Interactions","PS2.B","HS-PS2-4","Use mathematical representations of Newton’s Law of Gravitation and Coulomb’s Law to describe and predict the gravitational and electrostatic forces between objects.","Emphasis is on both quantitative and conceptual descriptions of gravitational and electric fields.","Assessment is limited to systems with two objects.",NA
"PS2.B-H3","NGSS","DCI","9,10,11,12","Attraction and repulsion between electric charges at the atomic scale explain the structure, properties, and transformations of matter, as well as the contact forces between material objects.","Disciplinary Core ideas",NA,NA,"Science",NA,NA,"Types of Interactions","PS2.B","HS-PS2-6","Communicate scientific and technical information about why the molecular-level structure is important in the functioning of designed materials.","Emphasis is on the attractive and repulsive forces that determine the functioning of the material. Examples could include why electrically conductive materials are often made of metal, flexible but durable materials are made up of long chained molecules, and pharmaceuticals are designed to interact with specific receptors.","Assessment is limited to provided molecular structures of specific designed materials.",NA
"PS3.A-E1","NGSS","DCI","3,4,5","The faster a given object is moving, the more energy it possesses.","Disciplinary Core ideas",NA,NA,"Science",NA,NA,"Definitions of Energy","PS3.A","4-PS3-1","Use evidence to construct an explanation relating the speed of an object to the energy of that object.","Assessment does not include quantitative measures of changes in the speed of an object or on any precise or quantitative definition of energy.","",NA
"PS3.A-E2","NGSS","DCI","3,4,5","Energy can be moved from place to place by moving objects or through sound, light, or electric currents.","Disciplinary Core ideas",NA,NA,"Science",NA,NA,"Definitions of Energy","PS3.A","4-PS3-2","Make observations to provide evidence that energy can be transferred from place to place by sound, light, heat, and electric currents.","Assessment does not include quantitative measurements of energy.","",NA
"PS3.A-M1","NGSS","DCI","6,7,8","Motion energy is properly called kinetic energy; it is proportional to the mass of the moving object and grows with the square of its speed.","Disciplinary Core ideas",NA,NA,"Science",NA,NA,"Definitions of Energy","PS3.A","MS-PS3-1","Construct and interpret graphical displays of data to describe the relationships of kinetic energy to the mass of an object and to the speed of an object.","Emphasis is on descriptive relationships between kinetic energy and mass separately from kinetic energy and speed. Examples could include riding a bicycle at different speeds, rolling different sizes of rocks downhill, and getting hit by a wiffle ball versus a tennis ball.","",NA
"PS3.A-M2","NGSS","DCI","6,7,8","A system of objects may also contain stored (potential) energy, depending on their relative positions.","Disciplinary Core ideas",NA,NA,"Science",NA,NA,"Definitions of Energy","PS3.A","MS-PS3-2","Develop a model to describe that when the arrangement of objects interacting at a distance changes, different amounts of potential energy are stored in the system.","Emphasis is on relative amounts of potential energy, not on calculations of potential energy. Examples of objects within systems interacting at varying distances could include: the Earth and either a roller coaster cart at varying positions on a hill or objects at varying heights on shelves, changing the direction/orientation of a magnet, and a balloon with static electrical charge being brought closer to a classmate’s hair. Examples of models could include representations, diagrams, pictures, and written descriptions of systems.","Assessment is limited to two objects and electric, magnetic, and gravitational interactions.",NA
"PS3.A-M3","NGSS","DCI","6,7,8","The term “heat” as used in everyday language refers both to thermal energy (the motion of atoms or molecules within a substance) and the transfer of that thermal energy from one object to another. In science, heat is used only for this second meaning; it refers to the energy transferred due to the temperature difference between two objects.","Disciplinary Core ideas",NA,NA,"Science",NA,NA,"Definitions of Energy","PS3.A","MS-PS1-4","Develop a model that predicts and describes changes in particle motion, temperature, and state of a pure substance when thermal energy is added or removed.","Emphasis is on qualitative molecular-level models of solids, liquids, and gases to show that adding or removing thermal energy increases or decreases kinetic energy of the particles until a change of state occurs. Examples of models could include drawing and diagrams. Examples of particles could include molecules or inert atoms. Examples of pure substances could include water, carbon dioxide, and helium.","",NA
"PS3.A-M4","NGSS","DCI","6,7,8","The temperature of a system is proportional to the average internal kinetic energy and potential energy per atom or molecule (whichever is the appropriate building block for the system’s material). The details of that relationship depend on the type of atom or molecule and the interactions among the atoms in the material. Temperature is not a direct measure of a system's total thermal energy. The total thermal energy (sometimes called the total internal energy) of a system depends jointly on the temperature, the total number of atoms in the system, and the state of the material.","Disciplinary Core ideas",NA,NA,"Science",NA,NA,"Definitions of Energy","PS3.A","MS-PS3-3","Apply scientific principles to design, construct, and test a device that either minimizes or maximizes thermal energy transfer.","Examples of devices could include an insulated box, a solar cooker, and a Styrofoam cup.","Assessment does not include calculating the total amount of thermal energy transferred.",NA
"PS3.A-H1","NGSS","DCI","9,10,11,12","Energy is a quantitative property of a system that depends on the motion and interactions of matter and radiation within that system. That there is a single quantity called energy is due to the fact that a system’s total energy is conserved, even as, within the system, energy is continually transferred from one object to another and between its various possible forms.","Disciplinary Core ideas",NA,NA,"Science",NA,NA,"Definitions of Energy","PS3.A","HS-PS3-1","Create a computational model to calculate the change in the energy of one component in a system when the change in energy of the other component(s) and energy flows in and out of the system are known.","Emphasis is on explaining the meaning of mathematical expressions used in the model.","Assessment is limited to basic algebraic expressions or computations; to systems of two or three components; and to thermal energy, kinetic energy, and/or the energies in gravitational, magnetic, or electric fields.",NA
"PS3.A-H2","NGSS","DCI","9,10,11,12","At the macroscopic scale, energy manifests itself in multiple ways, such as in motion, sound, light, and thermal energy.","Disciplinary Core ideas",NA,NA,"Science",NA,NA,"Definitions of Energy","PS3.A","HS-PS3-2","Develop and use models to illustrate that energy at the macroscopic scale can be accounted for as a combination of energy associated with the motions of particles (objects) and energy associated with the relative positions of particles (objects).","Examples of phenomena at the macroscopic scale could include the conversion of kinetic energy to thermal energy, the energy stored due to position of an object above the earth, and the energy stored between two electrically-charged plates. Examples of models could include diagrams, drawings, descriptions, and computer simulations.","",NA
"PS3.A-H3","NGSS","DCI","9,10,11,12","“Electrical energy” may mean energy stored in a battery or energy transmitted by electrical currents..","Disciplinary Core ideas",NA,NA,"Science",NA,NA,"Definitions of Energy","PS3.A","HS-PS2-5","Plan and conduct an investigation to provide evidence that an electric current can produce a magnetic field and that a changing magnetic field can produce an electric current.","Assessment is limited to designing and conducting investigations with provided materials and tools.","",NA
"PS3.A-H4","NGSS","DCI","9,10,11,12","These relationships are better understood at the microscopic scale, at which all of the different manifestations of energy can be modeled as a combination of energy associated with the motion of particles and energy associated with the configuration (relative position of the particles). In some cases the relative position energy can be thought of as stored in fields (which mediate interactions between particles). This last concept includes radiation, a phenomenon in which energy stored in fields moves across space.","Disciplinary Core ideas",NA,NA,"Science",NA,NA,"Definitions of Energy","PS3.A","HS-PS3-2","Develop and use models to illustrate that energy at the macroscopic scale can be accounted for as a combination of energy associated with the motions of particles (objects) and energy associated with the relative positions of particles (objects).","Examples of phenomena at the macroscopic scale could include the conversion of kinetic energy to thermal energy, the energy stored due to position of an object above the earth, and the energy stored between two electrically-charged plates. Examples of models could include diagrams, drawings, descriptions, and computer simulations.","",NA
"PS3.B-P1","NGSS","DCI","k,1,2","Sunlight warms Earth’s surface.","Disciplinary Core ideas",NA,NA,"Science",NA,NA,"Conservation of Energy & Energy Transfer","PS3.B","K-PS3-1","Make observations to determine the effect of sunlight on Earth’s surface.","Examples of Earth’s surface could include sand, soil, rocks, and water","Assessment of temperature is limited to relative measures such as warmer/cooler.",NA
"PS3.B-E1","NGSS","DCI","3,4,5","Energy is present whenever there are moving objects, sound, light, or heat. When objects collide, energy can be transferred from one object to another, thereby changing their motion. In such collisions, some energy is typically also transferred to the surrounding air; as a result, the air gets heated and sound is produced.","Disciplinary Core ideas",NA,NA,"Science",NA,NA,"Conservation of Energy & Energy Transfer","PS3.B","4-PS3-2","Make observations to provide evidence that energy can be transferred from place to place by sound, light, heat, and electric currents.","Assessment does not include quantitative measurements of energy.","",NA
"PS3.B-E2","NGSS","DCI","3,4,5","Light also transfers energy from place to place.","Disciplinary Core ideas",NA,NA,"Science",NA,NA,"Conservation of Energy & Energy Transfer","PS3.B","4-PS3-2","Make observations to provide evidence that energy can be transferred from place to place by sound, light, heat, and electric currents.","Assessment does not include quantitative measurements of energy.","",NA
"PS3.B-E3","NGSS","DCI","3,4,5","Energy can also be transferred from place to place by electric currents, which can then be used locally to produce motion, sound, heat, or light. The currents may have been produced to begin with by transforming the energy of motion into electrical energy.","Disciplinary Core ideas",NA,NA,"Science",NA,NA,"Conservation of Energy & Energy Transfer","PS3.B","4-PS3-2","Make observations to provide evidence that energy can be transferred from place to place by sound, light, heat, and electric currents.","Assessment does not include quantitative measurements of energy.","",NA
"PS3.B-M1","NGSS","DCI","6,7,8","When the motion energy of an object changes, there is inevitably some other change in energy at the same time.","Disciplinary Core ideas",NA,NA,"Science",NA,NA,"Conservation of Energy & Energy Transfer","PS3.B","MS-PS3-3","Apply scientific principles to design, construct, and test a device that either minimizes or maximizes thermal energy transfer.","Examples of devices could include an insulated box, a solar cooker, and a Styrofoam cup.","Assessment does not include calculating the total amount of thermal energy transferred.",NA
"PS3.B-M2","NGSS","DCI","6,7,8","The amount of energy transfer needed to change the temperature of a matter sample by a given amount depends on the nature of the matter, the size of the sample, and the environment.","Disciplinary Core ideas",NA,NA,"Science",NA,NA,"Conservation of Energy & Energy Transfer","PS3.B","MS-PS3-4","Plan an investigation to determine the relationships among the energy transferred, the type of matter, the mass, and the change in the average kinetic energy of the particles as measured by the temperature of the sample.","Examples of experiments could include comparing final water temperatures after different masses of ice melted in the same volume of water with the same initial temperature, the temperature change of samples of different materials with the same mass as they cool or heat in the environment, or the same material with different masses when a specific amount of energy is added.","Assessment does not include calculating the total amount of thermal energy transferred.",NA
"PS3.B-M3","NGSS","DCI","6,7,8","Energy is spontaneously transferred out of hotter regions or objects and into colder ones.","Disciplinary Core ideas",NA,NA,"Science",NA,NA,"Conservation of Energy & Energy Transfer","PS3.B","MS-PS3-3","Apply scientific principles to design, construct, and test a device that either minimizes or maximizes thermal energy transfer.","Examples of devices could include an insulated box, a solar cooker, and a Styrofoam cup.","Assessment does not include calculating the total amount of thermal energy transferred.",NA
"PS3.B-H1","NGSS","DCI","9,10,11,12","Conservation of energy means that the total change of energy in any system is always equal to the total energy transferred into or out of the system.","Disciplinary Core ideas",NA,NA,"Science",NA,NA,"Conservation of Energy & Energy Transfer","PS3.B","HS-PS3-1","Create a computational model to calculate the change in the energy of one component in a system when the change in energy of the other component(s) and energy flows in and out of the system are known.","Emphasis is on explaining the meaning of mathematical expressions used in the model.","Assessment is limited to basic algebraic expressions or computations; to systems of two or three components; and to thermal energy, kinetic energy, and/or the energies in gravitational, magnetic, or electric fields.",NA
"PS3.B-H2","NGSS","DCI","9,10,11,12","Energy cannot be created or destroyed, but it can be transported from one place to another and transferred between systems.","Disciplinary Core ideas",NA,NA,"Science",NA,NA,"Conservation of Energy & Energy Transfer","PS3.B","HS-PS3-1","Create a computational model to calculate the change in the energy of one component in a system when the change in energy of the other component(s) and energy flows in and out of the system are known.","Emphasis is on explaining the meaning of mathematical expressions used in the model.","Assessment is limited to basic algebraic expressions or computations; to systems of two or three components; and to thermal energy, kinetic energy, and/or the energies in gravitational, magnetic, or electric fields.",NA
"PS3.B-H3","NGSS","DCI","9,10,11,12","Mathematical expressions, which quantify how the stored energy in a system depends on its configuration (e.g. relative positions of charged particles, compression of a spring) and how kinetic energy depends on mass and speed, allow the concept of conservation of energy to be used to predict and describe system behavior.","Disciplinary Core ideas",NA,NA,"Science",NA,NA,"Conservation of Energy & Energy Transfer","PS3.B","HS-PS3-1","Create a computational model to calculate the change in the energy of one component in a system when the change in energy of the other component(s) and energy flows in and out of the system are known.","Emphasis is on explaining the meaning of mathematical expressions used in the model.","Assessment is limited to basic algebraic expressions or computations; to systems of two or three components; and to thermal energy, kinetic energy, and/or the energies in gravitational, magnetic, or electric fields.",NA
"PS3.B-H4","NGSS","DCI","9,10,11,12","The availability of energy limits what can occur in any system.","Disciplinary Core ideas",NA,NA,"Science",NA,NA,"Conservation of Energy & Energy Transfer","PS3.B","HS-PS3-1","Create a computational model to calculate the change in the energy of one component in a system when the change in energy of the other component(s) and energy flows in and out of the system are known.","Emphasis is on explaining the meaning of mathematical expressions used in the model.","Assessment is limited to basic algebraic expressions or computations; to systems of two or three components; and to thermal energy, kinetic energy, and/or the energies in gravitational, magnetic, or electric fields.",NA
"PS3.B-H5","NGSS","DCI","9,10,11,12","Uncontrolled systems always evolve toward more stable states–that is, toward more uniform energy distribution (e.g., water flows downhill, objects hotter than their surrounding environment cool down).","Disciplinary Core ideas",NA,NA,"Science",NA,NA,"Conservation of Energy & Energy Transfer","PS3.B","HS-PS3-4","Plan and conduct an investigation to provide evidence that the transfer of thermal energy when two components of different temperature are combined within a closed system results in a more uniform energy distribution among the components in the system (second law of thermodynamics).","Emphasis is on analyzing data from student investigations and using mathematical thinking to describe the energy changes both quantitatively and conceptually. Examples of investigations could include mixing liquids at different initial temperatures or adding objects at different temperatures to water.","Assessment is limited to investigations based on materials and tools provided to students.",NA
"PS3.C-P1","NGSS","DCI","k,1,2","A bigger push or pull makes things speed up or slow down more quickly.","Disciplinary Core ideas",NA,NA,"Science",NA,NA,"Relationship Between Energy & Forces","PS3.C","K-PS2-1","Plan and conduct an investigation to compare the effects of different strengths or different directions of pushes and pulls on the motion of an object.","Examples of pushes or pulls could include a string attached to an object being pulled, a person pushing an object, a person stopping a rolling ball, and two objects colliding and pushing on each other.","Assessment is limited to different relative strengths or different directions, but not both at the same time. Assessment does not include non-contact pushes or pulls such as those produced by magnets.",NA
"PS3.C-E1","NGSS","DCI","3,4,5","When objects collide, the contact forces transfer energy so as to change the objects’ motions.","Disciplinary Core ideas",NA,NA,"Science",NA,NA,"Relationship Between Energy & Forces","PS3.C","4-PS3-3","Ask questions and predict outcomes about the changes in energy that occur when objects collide.","Emphasis is on the change in the energy due to the change in speed, not on the forces, as objects interact.","Assessment does not include quantitative measurements of energy.",NA
